,text,aspect1,aspect2,aspect3,aspect4,aspect5,aspect6,aspect7
1578,áo_phao lót lông tai thỏ ạ mã nay yêu ấm thôi rôi ạ phao con lót lông gió lùa nổi mầu đỏ hồng,0,0,0,0,0,0,0
1579,giao hàng nhanh giá tốt bé nhà tớ uống ok mua thứ,1,1,0,1,0,0,1
1580,mu lúc_nào hài_lòng giá_cả ok,0,1,0,0,0,0,0
1581,đóng_gói cẩn_thận sp đúng đặt ủng_hộ,1,0,0,0,0,0,0
1582,đầu mua phân_vân giá sữa rẻ mọi chỗ mua bọc hàng cẩn_thận date xa sữa bóc ngửi mùi bột giống sữa con dùng yên_tâm ủng_hộ,0,1,0,0,0,1,0
1583,nhận dc hàng khui hàng mua mấy làn 5,0,0,0,0,0,0,1
1584,chua dùng chua biet the nao nhung thay cung ok 5 vi giao hàng nhanh đóng_gói đẹp,1,0,0,0,0,0,0
1585,đóng_gói cẩn_thận tốt lắm đóng_gói cẩn_thận,1,0,0,0,0,0,0
1586,giao hang nhanh dong gói cẩn_thận chất_lượng sản_phẩm dùng mói biêt se ung ho lan,1,0,0,0,0,0,0
1587,thời_gian giao hàng nhanh đóng_gói tạm thích quấn bằng túi_bóng chống sốc chèn xốp kiểu,1,0,0,0,0,0,0
1588,giao hàng nhanh tư_vấn tận_tình trả_lời khách_hàng nhanh,1,0,0,0,1,0,0
1589,đóng_gói chu_đáo bé uống sữa tăng cân ổn lắm,1,0,0,0,0,0,0
1590,giao hàng nhanh_chóng đóng_gói sản_phẩm cẩn_thận hài_lòng giá_cả,1,1,0,0,0,0,0
1591,giao hàng nhanh chất_lượng ổn cảm_ơn,1,0,0,1,0,0,0
1592,gói hàng cẩn_thận kĩ_càng hàng check mã_vạch ok rát yêu,1,0,1,0,0,0,0
1593,giao hàng cực nhanhh bỉm sài tốt tốt,1,0,0,1,0,0,0
1594,mua hàng mua giá_cả vừa_phải lòng tin mong hàng luôn hàng rõ nguồn_gốc đảm_bảo chất_lượng,0,1,0,0,0,0,0
1595,mua đầu biết chất_lượng 4 trl nhanhhhhh,0,0,0,0,1,0,0
1596,bé nhà thcihs sữa mua bao h kb chất_lượng ntn mn đánh_giá 5 m cung đặt niềm tin r mua thôi mong sữa châunr,0,0,0,0,0,0,1
1597,đóng_gói cẩn_thận giao hàng ok bé uống thử biết giống hàng_xách tay hay mua đánh_giá về chất_lượng,1,0,0,0,0,0,0
1598,chuea dùng ng riview ổn lắm ok thử hihihiiiiiiiiiiiiii,0,0,0,0,0,0,1
1599,sữa date 89 nói bọc hàng chắc_chắn ok giá rẻ bên ngoài,1,1,0,0,0,1,0
1600,mua thứ n nói chất_lượng ok mn mua aaaaaaa,0,0,0,1,0,0,0
1601,sd biết thế_nào,0,0,0,0,0,0,0
1602,chất luoeng sản_phẩm tuyệt_vời giao hsngf nhsnh đóng_gói cẩn_thận,1,0,0,1,0,0,0
1603,hàng chất_lượng cảm_ơn shopppppppoopppppppppppppppppppp,0,0,0,1,0,0,0
1604,mua lần_lần móp ít ở hộp hi_vọng quá_trình vận_chuyển,1,0,0,0,0,0,0
1605,hàng đúng nhận móp hộp biết đo vận_chuyển hay xếp_hàng,1,0,0,0,0,0,0
1606,sua ok lm ạ lai cok duoc trung thuong c on nhiu ạ e se mua ung ho nua ạ,0,0,0,0,0,0,1
1607,chất_lượng sản_phẩm tốt chất_lượng sản_phẩm tốt chất_lượng sản_phẩm tốt,0,0,0,1,0,0,0
1608,giao hàng nhanh hài_lòng về sản_phẩm,1,0,0,0,0,0,0
1609,chất_lượng sản_phẩm tuyệt_vời đóng_gói sản_phẩm đẹp giá_cả ok,1,1,0,1,0,0,0
1610,nhận hàng giao nhanh đóng_gói gọn hạn sử_dụng xa t62022,1,0,0,1,0,1,0
1611,đầu mua hàng đóng_gói cẩn_thận date xa giả tốt siêu_thị thanks,1,1,0,0,0,1,0
1612,mua tiếp_tục ủng_hộ,0,0,0,0,0,0,1
1613,đóng_gói cẩn_thận giao hàng nhanh sản_phẩm date xa_tít mù,1,0,0,0,0,1,0
1614,mua thứ n đóng_gói cẩn_thận,1,0,0,0,0,0,0
1615,giao hàng nhanh đúng sp date xa_giá tốt ủng_hộ lâu_dài,1,1,0,0,0,1,0
1616,giao hàng siêu nhanh mua mấy rhbbbjjjhhxbbh,1,0,0,0,0,0,0
1617,sản_phẩm chuẩn dùng tốt ủng_hộ tiếp giao hàng nhanh,1,0,0,0,0,0,0
1618,vị ngon dễ uống bé thích uống hộp móp nói_chung ok lắm,1,0,0,0,0,0,0
1619,rẻ mua ngoài một xíu mn ạ check kax vạch mn đánh tốt yên_tâm,0,1,0,0,0,0,0
1620,giao hàng nhanh hộp móp chất_lượng tốt ủng_hộ tiếp,1,0,0,1,0,0,0
1621,chất_lượng sản_phẩm ok đóng_gói chắc_chắn thời_gian giao hàng nhanh,1,0,0,1,0,0,0
1622,oke đóng_gói chắc_chắn kĩ check code giá tốt mua thử,1,1,0,0,0,0,0
1623,đóng_gói cẩn_thận ship nhanh_chóng ủng_hộ ạ,1,0,0,0,0,0,0
1624,dùng hết lon bé hợp_tác mìh mua hàng tem mác chuẩn cty ollin yên_tâm nè ủng_hộ,0,0,1,0,0,0,0
1625,t2 mua hàng ở mặc_dù ở xa gói kĩ hộp móp méo date xa mng yên_tâm tin_tưởng mua hàng bên,1,0,0,0,0,1,0
1626,giờ hàng now ship nhanh sữa check cod ok thứ mua hành rui,1,0,1,0,0,0,0
1627,mua lon bé chịu mua bán đúng hàng date xa ạ,0,0,1,0,0,1,0
1628,thời_gian giao hàng nhanh tem chính hãng công_ty nhập_khẩu hình_ảnh mang tính_chất nhận xu quảng_cáo,1,0,1,0,0,0,0
1629,mua_lẻ giá đắt mua thùng nhắn_tin tặng hộp đi tl,0,1,0,0,1,0,1
1630,hàng tem chính hãng bột mịn thơm hình_dáng hộp méo_mó vừa_lòng,1,0,1,1,0,0,0
1631,gói cẩn_thận đáy hộp méo chút hạn dài ok chỉ_mỗi_tội giao hàng lâu ngày 1111 đến hôm_nay mới nhận đc,1,0,0,0,0,1,0
1632,sữa nắp xanh date mới_tinh giao hàng nhanh chất_lượng dùng tốt ủng_hộ tiếp,1,0,0,0,0,1,0
1633,️hàng đẹp giá siêu rẻ khách yên_tâm mua_sắm nha ️bao chất bao giá toàn hà_nội ️đổi size đổi màu đổi lỗi đảm_bảo chuẩn ảnh,0,0,0,0,0,0,0
1634,giao hàng nhanh sản_phẩm mới bao_bì chắc_chắn tem chống hàng giả dán nhãn tiếng việt rõ_ràng tiếp_tục ủng_hộ,1,0,1,0,0,1,0
1635,sản_phẩm mô_tả,0,0,0,0,0,0,1
1636,mua thứ e nờ đóng_gói sản_phẩm đejp chắc_chắn giao hàng nhanh chát lượng satn phẩm tuyệt_vời rẻ mua ngoài miêkt mài mua kdkd kckr ochz ư kdn dke xk e ckve kd e kgvd lsj ekhd kì kk dkibe glje c keb e x,1,1,0,1,0,0,0
1637,đóng_gói cẩn_thận giao hàng nhanh mua tặng 5,1,0,0,0,0,0,0
1638,mua giao hàng nhanh sữa date xa sản_phẩm tuyệt_vời mua sale giá tốt,1,1,0,1,0,1,0
1639,ủng_hộ n mong nhìu ưu_đãi kh thân_thiết,0,0,0,0,0,0,1
1640,giao hàng nhanh giá hợp_lý biết check code mong chuẩn chính hãng,1,1,0,0,0,0,0
1641,mua đợt giảm_giá sử_dụng ok ủng_hộ tiếp giao hàng tạm ổn,1,1,0,0,0,0,0
1642,đóng_gói sản_phẩm chắc_chắn hạn sử_dụng dài giống sữa hay mua,1,0,0,0,0,1,0
1643,giao hàng xong thèm trả_lời luôn vgfiiciviciggufioggii,0,0,0,0,1,0,0
1644,giá rẻ chú_ý giao hàng tránh móp sữa,1,1,0,0,0,0,0
1645,giao hàng nhanh hôm_qua đặt hnay nhận đc r đóng_gói sản_phẩm chắc_chắn,1,0,0,0,0,0,0
1646,giao hàng nhanh đóng_gói cẩn_thận giao đúng sản_phẩm hộp mới móp tí ảnh_hưởng mấy,1,0,0,0,0,0,0
1647,ngày con e biết uống sữa toàn trung_thành ko_hà,0,0,0,0,0,0,1
1648,nhận đc hàng giao hàng siêu nhanh đóng_gói cản thận chủ lễ_phép thân_thiện dịp ủng_hộ tiếp ạ cảm_ơn nha,1,0,0,0,1,0,0
1649,chất_lượng sản_phẩm biết thế_nào đóng_gói cẩn_thận tgian giao hàng lâu chút chắc dịch_bệnh thông_cảm,1,0,0,0,0,0,1
1650,chất_lượng sản_phẩm tốt đóng_gói sản_phẩm chắc_chắn cẩn_thận,1,0,0,1,0,0,0
1651,sữa thơm mọi người ơi ship hàng chậm chêch mã_vạch ok mn,1,0,1,1,0,0,0
1652,sản_phẩm đóng_gói cẩn_thận khuyến_mãi giá ngợi ủng_hộ lâu_dài,1,1,0,0,0,0,0
1653,hàng nhận chuẩn ủng_hộ tiếp_nhận hàng nhanh_chóng s,1,0,1,0,0,0,0
1654,sua ngon dong goi can than giao hang nhanh tôi rat hai_long,1,0,0,1,0,0,0
1655,bé nhà uống sữa nan nga lc sơ_sinh mua chỗ siêu_thị đắt bán rẻ đặt mua đóng_gói chắc_chắn cẩn chất_lượng sp tin ở thui cũbg chả biết thế_nào con uống oki mua ủng_hộ tiếp,1,1,0,0,0,0,0
1656,chua dùng nen biết chất lượngsản phẩm co đầu_tiên mua sữa shoppe giao hàng nhanh đóng_gói đẹp va chắc_chắn,1,0,0,0,0,0,0
1657,hàng ok ức hình,0,0,0,1,0,0,1
1658,mua đóng hànhmg cẩn_thận ủng_hộ tiếp,1,0,0,0,0,0,0
1659,sp ok giao hàng nhanh nhìn_chung hài_lòng sản_phẩm mong hiệu_quả,1,0,0,1,0,0,0
1660,thời_gian giao hàng nhanh đóng_gói cẩn_thận mua tặng quà,1,0,0,0,1,0,0
1661,hộp sữa móp méo nặng ơi nặng mặc_dù thùng bên ngoài nguyên chèn xốp bên trong,1,0,0,0,0,0,0
1662,săn giá sale hài_lòng 5,0,1,0,0,0,0,0
1663,hàng ổn z cảm_ơn,0,0,0,1,0,0,1
1664,hộp móp chút,1,0,0,0,0,0,1
1665,chất_lượng sản_phẩm tuyệt_vời dóng gói cẩn thân giao hàng nhanh ủng_hộ tuêps,1,0,0,1,0,0,0
1666,chất_lượng sản_phẩm tuyệt_vời đóng_gói sản_phẩm đẹp xinh,1,0,0,1,0,0,0
1667,hàng okay đánh_giá thấp về dịch_vụ trước_sau rõ_ràng,0,0,0,1,1,0,0
1668,đầu mua kiểu hộp khác nan nga mua date xa gửi ship nhanh đóng_gói cẩn_thận móp méo dùng hết ổn mua ủng_hộ tiếp,1,0,0,1,0,1,0
1669,gjfb g v v vnvn n nvncncncn f fncncv cncncncncncnc cnfnnfncnc,0,0,0,0,0,0,0
1670,hx lgxohxohxogxkv lb lb lh lh hx lgxohxohxogxkv lb lb lh lh ogsotzogxogsoyzigzigzkvclhcohv,0,0,0,0,0,0,0
1671,giao hàng nhanh đóng_gói cẩn_thận ủng_hộ dài_dài,1,0,0,0,0,0,0
1672,bọc hàng cẩn_thận giao hàng siêu lâu hề nt thông_báo khách biết chất_lượng ok mua,1,0,0,0,1,0,0
1673,thời_gian giao hàng nhanh đóng_gói sản_phẩm cẩn_thận tiếp_tục ủng_hộ,1,0,0,0,0,0,0
1674,chất_lượng,0,0,0,1,0,0,1
1675,giao hàng nhanh sản_phẩm chất_lượng giá_thành hài_lòng,1,1,0,1,0,0,0
1676,đóng_gói kĩ giao hàng nhanh chất_lượng tốt giá_thành rẻ ️ ️ ️,1,1,0,1,0,0,0
1677,nhận đủ hàng 3 hộp móp mong nhận hàng móp thôi h tạm chấp_nhận,1,0,0,0,0,0,0
1678,lon móp check mã sp khui lon đánh_giá chất_lượng đc,1,0,1,0,0,0,0
1679,giao hàng nhanh hôm_nay đặt mai nhận gói hàng cẩn_thận mẫu_mã giống hộp mua hi_vọng chất_lượng tốt,1,0,0,0,0,0,0
1680,nhận dc hàng đóng_gói đẹp sữa mới date xa,1,0,0,0,0,1,0
1681,đóng_gói kĩ bóp_méo date tháng 12 xa mới tới mỗi_tội giao hàng lâu xíu chờ mòn_mỏi,1,0,0,1,0,1,0
1682,mua 3 chính hãng giá rẻ ủng_hộ dài_dài luôn ️ ️ ️ ️ ️ ️ ️ ️ ️ ️ ️ ️ ️ ️ ️ ️ ️ ️ ️ ️,0,1,1,0,0,0,0
1683,hy vong co nhieu voucher giam gia de dc mua sua giá tốt hao_tài hic,0,1,0,0,0,0,1
1684,phục_vụ nhiệt_tình mua đợt sale giao hàng lâu mọi_khi ngày_giờ 4 ngày mới nhận đc híc,1,1,0,0,1,0,0
1685,giao hang rat nhanh dong goi san pham chac chan chua su dung nen chua biet chat luong,0,0,0,0,0,0,0
1686,mua thứ n ưng gắn_bó lâu_dài,0,0,0,0,0,0,1
1687,mọi người yên_tâm mua đúng chính hãng đủ 9 vị vị bé thích sữa nặng chi_phí vận_chuyển cao,1,0,1,0,0,0,0
1688,giao nhanh hàng đúng mẫu date xa thử bk như_thế_nào lười chụp lấy tạm ảnh khác,1,0,1,0,0,1,0
1689,đặt ở hài_lòng,0,0,0,0,0,0,1
1690,bỉm giao nhanh hàng quà tặng đúng chuẩn chọn,1,0,0,0,1,0,0
1691,đánh_giá tạm sữa khui ẩm bé uống tiêu_chảy đợi phản_hồi,0,0,0,1,0,1,0
1692,sữa sale hợp_lí mã oke giao hàng nhanh bằng nowfood ủng_hộ trong đợt sale tiếp,1,1,0,0,0,0,0
1693,nhận hàng bé hợp_tác ủng_hộ mall lâu_dài cảm_ơn mall,0,0,0,1,0,0,1
1694,mở sử_dụng mua sữa quà vui chúc buôn_bán đắt hàng,0,0,0,0,1,0,0
1695,sữa thơm dóng gói cẩn_thận nói_chung ổniiiiiiiiiiiiiiiiiii,0,0,0,1,0,0,0
1696,nhận đủ sữa trả_lời tin nhắn nhiệt_tình lắm con thử rõ hợp_tác hay cảm_ơn,1,0,0,0,1,0,0
1697,nhận đc hàng hài_lòng về cách đóng_gói chất_lượng sản_phẩm cảm_ơn nha,1,0,0,1,0,0,0
1698,dùng thử lon nhỏ ổn mua lon lớn đầu mua hy_vọng chất_lượng tốt,0,0,0,0,0,0,1
1699,hàng ok ung hộ,0,0,0,1,0,0,1
1700,video klq giao hàng nhanh đóng_gói sp chắc_chắn mua yên_tâm,1,0,0,0,0,0,0
1701,ok date xa mới sx 52020 vỏ ghi made in korea uống giống mọi_khi mua ngoài tiệm,0,0,0,0,0,1,0
1702,giao hàng nhanh đóng_gói cẩn_thận ship nhiệt_tình tiếp_tục ủng_hộ,1,0,0,0,1,0,0
1703,cảm_ơn phục_vụ mùa mưa_lũ phục_vụ tốt chúc bán đắt hàng,0,0,0,0,1,0,0
1704,giao hàng nhanh chất_lượng sử_dụng biết như_thế_nào giá rẻ mua ở quán mua 5 hộp hộp móp sp tốt quay ủng_hộ,1,1,0,0,0,0,0
1705,hàng chuẩn date xa đóng_gói cẩn_thận chống shock lớp,1,0,1,0,0,1,0
1706,bọc hàng kĩ check mã hết tiếp_tục ủng_hộ,1,0,1,0,0,0,0
1707,sữa vị ngọt ngon bé nhà thích uống lắm date xa_tít yên_tâm mua hàng,0,0,0,1,0,1,0
1708,tuyệt_vời chất lương bọc hàng cẩn_thận gdygsogeyifgchu,1,0,0,1,0,0,0
1709,ôi mã ngon,0,0,0,0,0,0,1
1710,giá sữa lên_xuống giá xăng haizzz xuống chậm chậm tăng nhanh canh hoài chẳng xuống giao hàng chậm,1,1,0,0,0,0,0
1711,pikachu một trong loài pokémon xuất_hiện trong sản_phẩm nhượng quyền thương_mại video game anime truyện_tranh trò_chơi thẻ_bài liên_quan đến pokémon hợp_pháp_hoá the pokémon company một công_ty nhật_bản wikipedia,0,0,0,0,0,0,0
1712,đống hàng cẩn_thận okkkkkkkiiiiiiiiiiiiiiiiiiiiiii,1,0,0,0,0,0,0
1713,chất_lượng sản_phẩm okkkkkkkkkkkk thời_gian giao hàng lâuuuu,1,0,0,1,0,0,0
1714,cbi hàng nhanh giao hàng nhanh bỉm đúng size cảm_thấy mùi bỉm nó mùi mọi mua,1,0,0,1,0,0,0
1715,thứ 3 mua sữa mới 2th mua đến gần chục hộp trộm_vía bé hợp_tác tốt tháng hết 3 4 hộp dự trung_thành dài_dài,0,0,0,0,0,0,1
1716,giao hàng nhanh_chóng bsnnsnnsksns nn njsjwnsjznsjzjzns nhswjsinznzkzn mjzjwisjsnsnsn,1,0,0,0,0,0,0
1717,mới mua đầu biết hiệu_quả ok wuay sop mua hàng,0,0,0,0,0,0,1
1718,chất_lượng sản_phẩm tuyệt_vời date xa_giá tốt,0,1,0,1,0,1,0
1719,mua thứ 3 khỏi bàn luôn ủng_hộ dài_dài lắm luôn,0,0,0,0,0,0,1
1720,hàng tem đầy_đủ chất_lượng kiểm_chứng chua sử_dụng giao hàng nhanh ủng_hộ tiếp bé dùng phù_hợp tks,1,0,1,0,0,0,0
1721,đóng_gói cẩn_thận mua đúng thời_điểm sale mua giá tốt 833 hy_vọng chất_lượng tốt,1,1,0,0,0,0,0
1722,nhiệt_tình sản_phẩm tốt tặng 5 blabla bla bla bla bla,0,0,0,1,1,0,0
1723,chất_lượng sản_phẩm tuyệt_vời đóng_gói sản_phẩm chắc_chắn đẹp,1,0,0,1,0,0,0
1724,hàng tốt,0,0,0,1,0,0,1
1725,nhìn bên ngoài có_vẻ in sắc nét giống ảnh minh_hoạ hi_vọng hàng chuẩn mik check mã,0,0,1,0,0,0,1
1726,tiết_kiệm mua hộp sắt giá hợp_lí chất_lượng sữa tốt mua,0,1,0,1,0,0,0
1727,đóng_hộp sữa cẩn_thận giao hàng nhanh hình liên_quan ở nha_trang,1,0,0,0,0,0,0
1728,giao hàng nhanh hộp sữa méo vận_chuyển thùng giấy vị méo đc chèn xốp tuy ảnh_hưởng đến chất_lượng sữa thật_sự thất_vọng,1,0,0,0,0,0,0
1729,gần ngày black friday đặt sớm mất_công đơn hàng nhìu shipper giao kịp nào_ngờ t5 đặt t6 nhận dc lun hn sg lận,1,0,0,0,0,0,0
1730,phù_hợp vs giá tiền ok mọi người phù_hợp vs giá tiền ok mọi người phù_hợp vs giá tiền ok mọi người,0,1,0,0,0,0,0
1731,yên_tâm về chất_lượng hii bọc gói sp chắc_chắn giao hàng nhanh thaks shopppp,1,0,0,1,0,0,0
1732,mua giao hàng nhanh giá tốt tiếp_tục ủng_hộ,1,1,0,0,0,0,0
1733,đot mua dc nam giá tốt đot giá mua ạ,0,1,0,0,0,0,0
1734,hình_ảnh video mang tính_chất nhận xu giao hàng nhanh giá_thành hợp_lý date 2022,1,1,0,0,0,1,0
1735,giao hàng chậm chút chắc sale 99 hàng đóng_gói cẩn_thận date 2022,1,0,0,0,0,1,0
1736,giao hàng nhanh khủng_khiếp đặt tối sáng giao mua đc giá ok hộp tiếp_tục ủng_hộ,1,1,0,0,0,0,0
1737,giao hàng nhanh date sữa xa nói_chung ưng,1,0,0,0,0,1,0
1738,giao hàng nhanh đóng_gói cẩn_thận cảm_ơn shopgiao hàng nhanh đóng_gói cẩn_thận cảm_ơn,1,0,0,0,0,0,0
1739,bịch sữa to_đùng uống ngon lắm ạ,0,0,0,1,0,0,0
1740,đợt gần withmom cty trợ_giá khách_hàng 150k giá cực mềm dòng sữa ok bé dùng gần 60 lon sữa tem date khác nhau màu lon sữa lon sữa nó tơi mịn lon sữa bột nó bám bám í hiểu đc,0,1,0,1,0,0,0
1741,đóng hàng cẩn_thận lớp hộp méo chút giá rẻ chút mua ngoài,1,1,0,0,0,0,0
1742,đáng mua chất_lượng tốt đóng gỏi kỹ_càng ngọt hài_lòng,1,0,0,1,0,0,0
1743,đóng_gói cẩn_thận hộp móp mua thứ 5,1,0,0,0,0,0,0
1744,đóng_gói sản_phẩm chắc_chắn tem nhập_khẩu date 72021 mong gửi date xa,1,0,1,0,0,1,0
1745,mua yên_tâm về chất_lượng con uống loại hợp,0,0,0,1,0,0,0
1746,tem mác đầy_đủ giao hàng nhanh nvgh thân_thiện nhiệt_tình,1,0,1,0,1,0,0
1747,đóng cẩn_thận lắm date xa đáng mua mọi người,1,0,0,0,0,1,0
1748,mua hàng chuẩn,0,0,1,0,0,0,0
1749,bé nhà uống sữa hợp ăn khoẻ ngủ tốt biết tăng cân có_da_có_thịt mua,0,0,0,1,0,0,1
1750,mua hàng chất_lượng sp tốt đóng_gói cẩn_thận,1,0,0,1,0,0,0
1751,hàng chuẩn date xa uy_tín,0,0,1,0,0,1,0
1752,giao hàng nhanh dc hoàn 30k sữa tốt gou,1,1,0,1,0,0,0
1753,giao hàng nhanh_chóng đóng_gói cẩn_thận tiếp_tục ủng_hộ,1,0,0,0,0,0,0
1754,mua sảnbphaamr phùvhopwk gia tien bịch gần mặc con ban_đêm tràn,0,1,0,1,0,0,0
1755,giao hàng nhah mua dk sale rẻ chút halamsmddbamsmnbbmmnbvkk,1,1,0,0,0,0,0
1756,chất_lượng sản_phẩm tuyệt_vời giao đúng hàng đóng_gói cẩn_thận,1,0,0,1,0,0,0
1757,sữa date xa ship nhanh ạ ủng_hộ tiếp hộp mới v,1,0,0,0,0,1,0
1758,sữa vấn de gi vận_chuyển lâu đặt giao hoả_tốc 5 mới giao cach tra loi tin nhan may hài_lòng,1,0,0,0,1,0,0
1759,tư_vấn nhiệt_tình giao hàng nhanh sử_dụng đk vài ngày sản_phẩm tốt ưng ủng hộp dài_dài,1,0,0,1,1,0,0
1760,uy_tín nhiệt_tình kín_đáo,0,0,0,0,0,0,1
1761,sản_phẩm đăng date dài đáng tiền giao hàng nhanh,1,0,0,0,0,1,0
1762,giao đủ bỉm giao siêu nhanh mua tặng tất bùn,1,0,0,0,1,0,0
1763,sp ok ủng_hộ tiếp,0,0,0,1,0,0,0
1764,đánh_giá lấy xu thôi mua thứ n kẻ tiếp_tục ủng_hộ,0,0,0,0,0,0,1
1765,giao bỉm nhanh chất_lượng tuyệt_vời ủng_hộ lâu_dài,1,0,0,1,0,0,0
1766,sữa check mã_vạch ok ủng_hộ tiếp kkkkkkkkkkkkkkkkkkkkkghkkjggbjjn,0,0,1,0,0,0,0
1767,sữa hàng chuẩn giao hàng nhanh ưng aạaaaaaaaaaaaaaaaaaaaaaaaaaa,1,0,1,0,0,0,0
1768,date sữa xa uống mùi thơm ngậy kiểm_tra mã_vạch chuẩn nói_chung lựa_chọn đúng săn giá giảm chất_lượng ok ủng_hộ dài,0,1,1,1,0,1,0
1769,nhận đc hàng ok ok dchbcgcjbjbtfiivgvhhkbchxggxvjbhxtgknhxcuvib,0,0,0,0,0,0,0
1770,giao hàng nhanh sp đúng mẫu_mã ủng_hộ sộp tiếp canh sale giá rẻ,1,1,0,0,0,0,0
1771,hàng y hình sữa date mới hạn_dùng 2022 đóng_gói hàng cẩn_thận,1,0,0,0,0,1,0
1772,giao hàng nhanh gói hàng cẩn thậnh giao hàng nhanh gói hàng cẩn thậnhs,1,0,0,0,0,0,0
1773,đóng goi chac chắn hạn sd xa_giá hạt_dẻ tuyệt_vời sp,1,1,0,0,0,1,0
1774,đóng_gói cẩn_thận sd biết chất_lượng hi_vọng bé hợp_tác,1,0,0,0,0,0,0
1775,đóng_gói cẩn_thận giao hàng nhanh nhìn sản_phẩm bắt_mắt dùng thử,1,0,0,0,0,0,0
1776,giao hàng siêu nhanh bé nhà dùng hợp ủng_hộ,1,0,0,0,0,0,0
1777,ơ mây zing gút chóp hẹn tiếp ủng_hộ mua tkank kiu,0,0,0,0,0,0,1
1778,mua giá tốt 1212 con dùng sữa tốt uống nhanh hết,0,1,0,1,0,0,0
1779,giao hàng lâu gần tuần mới nhậb dc nhận hàng tem dán gửi đi hải_dương tem đè,1,0,0,0,0,0,0
1780,đặt hiểu nắp xanh tuy_nhiên giao nhanh,1,0,0,0,1,0,0
1781,hàng chuẩn giá tốt 5,0,1,1,0,0,0,0
1782,giao hàng siêu nhanh mua hài_lòng yên_tâm,1,0,0,0,0,0,0
1783,đóng hàng cận thận,1,0,0,0,0,0,0
1784,sản_phẩm chất_lượng tuyệt_vời đóng_gói sản_phẩm kỹ đẹp chắc_chắn phục_vụ tốt thời_gian giao hàng nhanh,1,0,0,1,1,0,0
1785,chất_lượng sản_phẩm tuyệt_vời thời_gian giao hàng nhanh,1,0,0,1,0,0,0
1786,sua hình mua hai móp,1,0,0,0,0,0,0
1787,ship chậm hàng tốt,1,0,0,1,0,0,0
1788,sản_phẩm ổn a mong miễn_phí ship hơn_nữa,1,0,0,1,0,0,1
1789,sữa tốt đóng_gói cẩn_thận,1,0,0,1,0,0,0
1790,mua túi tuyệt đẹp ủng hỗ dài_dài,0,0,0,1,0,0,0
1791,chọn bhnt chọn chubb life liên_hệ hotline 0938871369 tư_vấn giải_pháp,0,0,0,0,0,0,0
1792,mua 3 giao hàng nhanh đóng_gói cẩn_thận vbsbdbbddbbdbdbd,1,0,0,0,0,0,0
1793,chất_lượng sp tốt giao hàng nhanh tiếp_tục ủng_hộ ️ ️ ️,1,0,0,1,0,0,0
1794,bfjfksbcknabfnncxj chủ_yếu lấy xu nskfbfbnsnabdjsbbxbjfjncncjjcbxbsbjwkwbcnkvgbb,0,0,0,0,0,0,0
1795,có_vẻ xịn ủng_hộ tiếp,0,0,0,0,0,0,1
1796,chất_lượng sản_phẩm tuyệt dùg lâu cũg giới_thiệu nhìu người giao hàg cũg nhanh,1,0,0,1,0,0,0
1797,giao hàng nhanh sp chất_lượng ủng_hộ shopppppp dài ạ,1,0,0,1,0,0,0
1798,hình_thức trả lương 96 bộ_luật lao_động 2019 quy_định điểm mới 94 bộ_luật lao_động 2012 người lao_động người sử_dụng lao_động thoả_thuận về hình_thức trả lương trường_hợp trả lương tài_khoản cá_nhân người lao_động doanh_nghiệp trả,0,0,0,0,0,0,0
1799,thời_gian giao hàng nhanh đóng_gói cẩn_thận chắc_chắn sữa data mới mua hàng ở lâu yên_tâm,1,0,0,1,0,0,0
1800,đóng hàng cẩn_thận chắc_chắn sữa date mới đóng hàng cẩn_thận chắc_chắn sữa date mới,1,0,0,0,0,1,0
1801,giao hàng nhanh ban_đầu mùi nồng bé có_vẻ thích hôm quen uống nhanh,1,0,0,1,0,0,0
1802,đầu mua giống sữa m mua trc ok vc lâu chút,1,0,0,0,0,0,0
1803,mặc_dù lon sữa móp méo tư_vấn nhiệt_tình hàng chất_lượng 5,1,0,0,1,1,0,0
1804,giao hàng nhanh đóng_gói cẩn_thận chất_lượng sản_phẩm ổn hộp móp xíu ok,1,0,0,1,1,0,0
1805,giao hàng nhanh đóng_gói cẩn_thận hàng chuẩn,1,0,1,0,0,0,0
1806,sản_phẩm tốt lắm ủng_hộ giao hàng siu nhanh chị tv giúp e sp bên sản_phẩm tốt lắm ủng_hộ,1,0,0,1,1,0,0
1807,khách_hàng quen sp tốt thương mua kho dính hàng dính băng keo hộp sữa khó bóc bóc bẩn ok,0,0,0,0,1,0,0
1808,giao hàng nhanh sữa thơm bé nhà thích unhr hộ,1,0,0,1,0,0,0
1809,đóng_gói đẹp nhanh,1,0,0,0,0,0,0
1810,màu đẹp dùng filter khác ngoài đời màu đẹp lm nhe,0,0,0,0,0,0,0
1811,bỉm tôtttttttttttttt mua thứ 7 hiiiiiiiiiiiiiiiiiiiiiiiiiiiiiiiiiiiii,0,0,0,1,0,0,1
1812,giao hàng nhanh đủ hàng sản_phẩm dùng tốt ưng ủng_hộ,1,0,0,1,0,0,0
1813,10 điểm giao hàng đầy_đủ ủng_hộ tiếp,1,0,0,0,0,0,0
1814,sữa thơm ngon mua dc rẻ bên ngoài nh,0,1,0,1,0,0,0
1815,giao hàng nhanh sữa thơm ngon bé nhà đầu dùng loại trộm_vía hợp_tác luôn đóng_gói cẩn_thận chèn xốp móp méo,1,0,0,1,0,0,0
1816,hàng nắp xanh date xa 2022 đóng_gói cẩn_thận giao hàng nhanh tháng m mua 5 hộp,1,0,1,0,0,1,0
1817,giao hàng nhanh sữa check mã_vạch giá sale rẻ,1,1,1,0,0,0,0
1818,hàng sănz e trả ảnh sàn video ạ buôn 185 𝙲𝚑𝚒̉ 𝚖𝚘𝚗𝚐 𝚎𝚖 𝚖𝚊̃𝚒 𝚐𝚒𝚞̛̃ đ𝚞̛𝚘̛̣𝚌 𝚗𝚞̣ 𝚌𝚞̛𝚘̛̀𝚒 𝚝𝚛𝚎̂𝚗 𝚖𝚘̂𝚒 𝙷𝚘̛𝚗 𝚌𝚊̉ 𝚌𝚊́𝚒 𝚎𝚖 𝚌𝚊̂̀𝚗 𝚕𝚊̀ 𝚑𝚞𝚗 𝚖𝚘̂𝚒 𝚖𝚘̂̃𝚒 𝚝𝚘̂́𝚒 se lạnh retock set váy maxi mixx áo cadigan tàu cực đẹp luôn váy đẹp lắm nha khách iu,0,0,0,0,0,0,0
1819,mua đóng_gói cẩn_thận đẹp check code ok,1,0,1,0,1,0,0
1820,giao hàng nhanh đóng_gói cẩm thận,1,0,0,0,0,0,0
1821,mượn tạm hình_ảnh bé bú mẹ hoàn_toàn biết uống sữa ngoài nì dị_ứng hay phản_ứng,0,0,0,0,0,0,1
1822,hình_ảnh video mang tc hoạ nhận su đóng_gói sp chắc_chắn mua đc giá sale,1,1,0,0,0,0,0
1823,sản_phẩm tốt mùi_vị bé dễ uống đóng_gói sản_phẩm chắc_chắn,1,0,0,1,0,0,0
1824,cân gấp nhờ book now siu nhanh ucucuvugg8g8g8g8g8g8g8h,0,0,0,0,0,0,0
1825,giá rẻ vs chỗ,0,1,0,0,0,0,0
1826,sản_phẩm đẹp chất_lượng ok giá_cả phải_chăng ủng_hộ,0,1,0,1,0,0,0
1827,nhận đủ hàng nha đứa thik vị cu nhà nghiện vị chuối,0,0,0,0,0,0,1
1828,sp chất_lượng giao hàng nhanh ngày cn shiper nghỉ,1,0,0,1,0,0,0
1829,giao hàng nhanh sữa chuẩn hy_vọng luôn uy_tín ủng_hộ đai dài,1,0,1,0,0,0,0
1830,sản_phẩm sữa chất_lượng tốt biết cách kiểm_tra códe sản_phẩm biết phản_hồi sữa ngon_ngọt nhẹ,0,0,0,1,0,0,0
1831,sản_phẩm gồm ngăn tách_biệt ngăn dùng đựng máy hút sữa ngăn dùng đựng sữa bạn sử_dụng sản_phẩm hai cách cầm quai xách bên hoặc đeo vai đeo chéo mẫu 3 4 riêng mẫu 5 bạn đeo balo phần ngăn gel lạnh chống ẩm ngăn phầ,0,0,0,0,0,0,0
1832,chán muốn mua thắc_mắc rep gói hàng ẩu đúng mua hàng ol may_mắn thôi,1,0,0,0,1,0,0
1833,ha lquan cơ_mà sữa chuẩn ship nhanh lsau đặt tiếp hehe,1,0,1,0,0,0,0
1834,giao hàng cực nhanh đóng_gói bọc hàng kỹ chắc_chắn,1,0,0,0,0,0,0
