,text,aspect1,aspect2,aspect3,aspect4,aspect5,aspect6,aspect7
4149,đắt xíu quà đẹp bỉm ưng giáo hàng nhanh shipper nhiệt_tình,1,1,0,0,0,0,0
4150,hàng đóng_gói kỹ giao nhanh tuy_nhiên so_sánh hàng siêu_thị mua ở big c miếng tả cầm nhẹ mùi thơm thắc_mắc vấn_đề,1,0,0,1,0,0,0
4151,km mua giá tốt rẻ giá niêm_yết pampers giá cao toàn canh coa km mua bỉm mỏng thấm tốt bé 8kg2 mặc size m l hằn lưng thun chặt size xl lưng thun coa vẻ mềm chút thử bé đánh_giá,0,1,0,1,0,0,0
4152,mẹ biển sữa mua sản_phẩm hợp túi_tiền ok lắm,0,1,0,0,0,0,0
4153,sản_phẩm chất_lượng đóng_gói cẩn_thận sử_dụng bé năm ok ️ ️ ️ ️ ️,1,0,0,1,0,0,0
4154,thiếu mất con vít huhu ráp dễ_thương,0,0,0,0,0,0,0
4155,tả mỏng giá_cả phải_chăng phù_hợp điều_kiện kinh_tế gia_đình,0,1,0,1,0,0,0
4156,dùng tốt sản_phẩm an_toàn bé giá_thành cao đáng tiền,0,1,0,1,0,1,0
4157,đóng_gói chắc_chắn sp chất_lượng giá_cả hợp_lí,1,1,0,1,0,0,0
4158,bao_bì cẩn_thận,1,0,0,0,0,0,0
4159,mua mua bịch tiếp hàng giá tốt thị_trường ship tiện_lợi đi mua hết_mình mua tiếp,0,1,0,0,0,0,0
4160,hàng ok ủng_hộ,0,0,0,0,0,0,1
4161,quà tặng quà tặng đâu giao hàng lâu,1,0,0,0,1,0,0
4162,biết bên hay bên vận_chuyển gói tã rách thế_này rách lớp nilon quấn ngoài bịch tã vô tới bịch luôn da em bé dễ dị_ứng rách thế_này bụi bẩn xâm_nhập trong trong quá_trình vận_chuyển quấn lớp nilon bên ngoài dày mọi_khi mới dễ rách như_vậy mong cải_thiện vấn_đề đảm_bảo an_toàn em bé sử_dụng sản_phẩm hoặc khỏi mất thời_gian đổi hàng,1,0,0,0,0,1,0
4163,bỉm mùi hôi khó_chịu bao_bì cũ nhàu bé nhà dùng một ngày xong nổi mụn vùng bẹn,0,0,0,1,0,1,0
4164,mua xong kiểm_tra mã_vạch thế_này mong một lời giải_thích,0,0,1,0,0,0,0
4165,tả mang ôm vừa_vặn tràn hsd mới,0,0,0,1,0,1,0
4166,tot hngf hiao ngabh hàng giao nhanh sp tốt,1,0,0,0,0,0,0
4167,sản_phẩm tuyệt_vời cám sơn ạ,0,0,0,0,0,0,1
4168,sp rat dung voi mo ta a_giao hang rat de thuong va nhiet tinh se ung ho,1,0,0,0,0,0,0
4169,san pham minh da mua nhieu lan chat luong ok dong goi can than ta dung thoai mai,1,0,0,1,0,0,0
4170,sử_dụng kén bình sữa mong bên bán nho,0,0,0,1,0,0,0
4171,bỉm dùng ok thấm hút tốt ủng_hộ lâu_dài,0,0,0,1,0,0,0
4172,tã rộng mùi bé nhà dùng hợp tã bobby,0,0,0,1,0,1,0
4173,giao hàng nhanh đóng_gói cẩn_thận bạn đồng_hành kiti,1,0,0,0,0,0,0
4174,hàng giao nhanh bất_ngờ đóng_gói kỹ sản_phẩm chất_lượng,1,0,0,1,0,0,0
4175,sản_phẩm dùng khô thoáng giá_cả hợp_lý cảm_ơn gửi hàng nhanh,1,1,0,1,0,0,0
4176,sản_phẩm ok bộ lắp_ráp bé nhà thích giao hàng nhanh,0,0,0,0,0,0,0
4177,giao nhanh hàng chất_lượng luôn ủng_hộ,1,0,0,1,0,0,0
4178,giao hàng chậm tuần,1,0,0,0,0,0,0
4179,giao hàng nhanh chất_lượng tốt,1,0,0,1,0,0,0
4180,sản_phẩm tốt ủng_hộ,0,0,0,0,0,0,1
4181,bé mặc y tuy bth bé mặc size xxl xl meries mặc êm khô thoáng nhanh lắm,0,0,0,1,0,0,0
4182,mới dùng toạc như_vầy tã đợt chất_lượng,0,0,0,1,0,0,0
4183,sản_phẩm giá giao hàng chậm đặc_biệt giao hàng cũ bao_bì ránh tùm_lum,1,0,0,0,0,1,0
4184,10 10 mã gia r 91k đơn 1600k mua hẳn lon to giùm chị giá giảm tốt bằng giá shopee 962k kèm quà or vnpayqr giảm 100k ở kidsplaza bibomart 985k 885k,0,1,0,0,0,0,0
4185,dịch_vụ tốt nhân_viên giao hàng thân_thiện tin_dùng sản_phẩm trading cung_cấp,1,0,0,0,1,0,0
4186,giá tốt giao hàng nhanh giờ muốn mua giá hết tốt,1,1,0,0,0,0,0
4187,sản_phẩm hình đóng_gói kỹ,1,0,0,0,0,0,0
4188,đóng_gói tệ giao sữa móp nửa lon bạn thường_xuyên thay nhau đặt sữa ở cửa_hàng đặt 3lon cách làm_việc thiếu chuyên_nghiệp,1,0,0,0,0,0,0
4189,hàng tốt nhân_viên giao hàng nhiệt_tình thân_thiện,1,0,0,0,0,0,0
4190,hay mua bỉm bên mua biết bn r hài_lòng,0,0,0,0,0,0,1
4191,dùng ban_ngày thích bỉm phần lưng co_giãn tốt bỉm mỏng nhẹ,0,0,0,1,0,0,0
4192,thích dòng sản_phẩm luôn thích dùng giữ dáng thấm hút tốt,0,0,0,1,0,0,0
4193,sp dùng ok ah giao hàng nhanh,1,0,0,1,0,0,0
4194,mới mua về khoảng 2h mùi bình khó_chịu mong bán hàng mặc khác tốt,0,0,0,0,0,0,0
4195,bao_bì rách bé dùng ok hài_lòng bé dùng đc mấy miếng hăm bên bẹn nổi đầy hạt đỏ m ngoài về dùng lặn hết bịch dùng bỉm,0,0,0,0,0,1,0
4196,hàng hết date mua,0,0,0,0,0,1,0
4197,giao hàng nhanh,1,0,0,0,0,0,0
4198,dùng biết mua 3 gói dk tặng xe_đạp bé,0,0,0,0,1,0,0
4199,ta rat mem min be yeu,0,0,0,1,0,0,0
4200,thường_lệ like like like sp ban_ngày bé xài tháng thứ đến nay,0,0,0,0,0,0,1
4201,tả merri khỏi chê ạ bé em xài ok lắm,0,0,0,1,0,0,0
4202,sản_phẩm ok tuy_nhiên nói quà tặng kèm mua bịch quà,0,0,0,0,1,0,0
4203,giao hàng nhanh bỉm cháu mới 6 kg mặc lớn tý chật,1,0,0,0,0,0,0
4204,đúng chất_lượng quảng_cáo hsd mới đóng_gói đẹp chắc_chắn vận_chuyển nhanh,1,0,0,1,0,1,0
4205,tuyệt_vời ưng bé ngủ trọn_vẹn khô thoáng,0,0,0,1,0,0,0
4206,hàng hình bọc cẩn_thận bao_bì in đậm rõ_ràng giống mua ngoài siêu_thị hangt chuẩn mọi ng ghi tặng 9 miếng mua,1,0,1,0,1,0,0
4207,hiệu xài bé sinh tới giờ,0,0,0,0,0,0,1
4208,giao hàng nhanh đặt ngày hôm trươc hôm nhận đc,1,0,0,0,0,0,0
4209,giao hàng giao khuyến_mãi giao đúng quảng_cáo,0,0,0,0,1,0,0
4210,giao hàng cực nhanh chất_lượng sp tốt,1,0,0,1,0,0,0
4211,sản_phẩm mùi khó chụi loại tã khác mùi dùng tạm dc,0,0,0,1,0,0,0
4212,hàng đẹp,0,0,0,0,0,0,1
4213,san pham tot duoc bao bi dong goi can than nhu mong doi,1,0,0,0,0,0,0
4214,tã quần bobby thấm tốt suốt đêm mẫu_mã màu_sắc đẹp hình_ảnh hoạt_hình ngộ_nghĩnh dễ_thương có_vẻ thiên về dành con gái hay ấy lưng thun mềm_mại dễ_chịu hằn quanh lưng,0,0,0,1,0,0,0
4215,đóng_gói cẩn_thận giao hàng nhanh,1,0,0,0,0,0,0
4216,mua hàng đóng goi cẩu_thả,1,0,0,0,0,0,0
4217,sản_phẩm giống mô_tả chất_lượng tốt giao hàng nhanh,1,0,0,1,0,0,0
4218,mua nha mn,0,0,0,0,0,0,1
4219,hai_long voi san pham da mua,0,0,0,0,0,0,1
4220,kiểu_dáng đẹp mềm mịn mua sử_dụng đánh_giá về chất_lượng,0,0,0,1,0,0,0
4221,san pham tot mong_đợi,0,0,0,0,0,0,1
4222,tả mỏng bé mặc thoáng mát loại tã khác vòng bụng ôm văn bé vận_động dễ_dàng,0,1,0,1,0,0,0
4223,tã thấm ướt giá_thành rẻ chất_lượng tốt,0,1,0,1,0,0,0
4224,sản_phẩm đónh gói tốt nhân_viên vui_vẻ,1,0,0,0,0,0,0
4225,sản_phẩm dùng ok giao hàng nhanh tuyệt nhất,1,0,0,1,0,0,0
4226,hài_lòng sản_phẩm tốt săn giá mềm mua ở cửa_hàng,0,1,0,0,0,0,0
4227,tã thấm hút tốt_bụng lằn chật đùi bé 6kg xé mép xíu,0,0,0,1,0,0,0
4228,sp thấm hút tốt mềm_mại dùng sang loại boddy khác hoàn_toàn thô cứng ủng_hộ tiếp bữa mua 335k nay 345k mất,0,1,0,1,0,0,0
4229,tả mỏng lỡ mua tả kém chất_lượng,0,0,0,1,0,0,0
4230,đóng_gói chắc_chắn giao hàng nhanh sp chất_lượng mk hài_lòng,1,0,0,1,0,0,0
4231,m đặt mua bich bỉm goon friend nhận dc hag bịch 18 miếng hàng tặng hnay nhận dc hag ktra giúp m,0,0,0,0,1,0,0
4232,mua 3xl ma giao size m giao lộn thu_hồi giùm,0,0,0,0,1,0,0
4233,balo đẹp chắc_chắn đáng giá tiền bỏ,0,0,0,0,0,0,0
4234,9 miếng tặng đâu bỉm loại cũ phiên_bản mới đệm lưng thấm mồ_hôi,0,0,0,0,1,0,0
4235,giao hàng tệ,1,0,0,0,0,0,0
4236,mua dc giá tốt hộp 709k dc tặng quà cảm_ơn,0,1,0,0,1,0,0
4237,mua ủng_hộ nhiùuuuuuuu,0,0,0,0,0,0,1
4238,tôi hài_lòng về sản_phẩm giao hàng nhanh chắc_chắn,1,0,0,0,0,0,0
4239,sản_phẩm đóng_gói chắc_chắn về chất_lượng bỉm loại mềm vón cục phù_hợp bé khoảng tuổi nghịch hay chạy quà tặng kèm xe tháo_lắp biết thế_nào đồ_chơi trong quảng_cáo túi mấy con thực_tế con_bé xíu buồn,0,0,0,1,1,0,0
4240,sản phầm gọi_là tạm về chất_lượng 3 thôi giá_thành đc 3 bãi tràn ướt hết đệm,0,1,0,1,0,0,0
4241,bao_bì cũ bẩn bám bụi,0,0,0,0,1,1,0
4242,nghĩ sản_phẩm xuất đi đâu đâu một sản_phẩm lỗi in xấu hình xấu đường may ẩu_tả,0,0,0,1,0,0,0
4243,giá tốt hạn sử_dụng mới hàng chuẩn mùi thơm dịu nhẹ dễ_chịu,0,1,1,1,0,1,0
4244,cực_kì hài_lòng luôn,0,0,0,0,0,0,1
4245,hôm_qua đặt giá 549k hnay định đặt tiếp giá 579k làm giới_thiệu người_nhà mua đã_đời vô giá vầy biết nói luôn,0,1,0,0,0,0,0
4246,lưng tã thiết_kế mới chống mồ_hôi giúp bé thoải_mái,0,0,0,1,0,0,0
4247,sản_phẩm đẹp nhựa chắc_chắn,0,0,0,0,0,0,0
4248,tã dùng cực thích to bé mang đêm khô_ráo dùng unidry bé hăm nửa giá vừa_phải sau_này tiếp_tục sd,0,1,0,1,0,0,0
4249,túi thần_kỳ chất_lượng tốt giá_cả phải_chăng,0,0,0,0,0,0,0
4250,tuyệt_vời u2hbsjsoeojebrhidooonw nzuibbbjingy7hbb bi,0,0,0,0,0,0,0
4251,cực_kì hài_lòng cực_kì hài_lòng cực_kì hài_lòng cực_kì hài_lòng,0,0,0,0,0,0,0
4252,cực_kì hài_lòng bỉm pampers thấm tốt dầy làm em bé bức_bối like,0,0,0,1,0,0,0
4253,tã mềm siêu mỏng siêu thấm bé dùng đêm 12h mông khô thoáng ẩm rít mông loại tã thông thưởng,0,0,0,1,0,0,0
4254,bỉm dùng thích màu_sắc nhã_nhặn tuy giá đắt đúng tiền đấy,0,1,0,1,0,0,0
4255,hàng hình size xl bobby to loại size xl hãng huggies pampers moony merries mua thử size l bobby bobby size l con mặc chật xl thi,0,0,0,0,0,0,1
4256,giao hộp móp,1,0,0,0,0,0,0
4257,hài_lòng cảm_ơn,0,0,0,0,0,0,1
4258,tạm tã mỏng nặng_mùi hài_lòng về mùi nhựahoá chất,0,0,0,1,0,0,0
4259,kh thân_thiết lâu bao_giờ đánh_giá ít như_vậy đợt nói đặt combo 4 bịch tã quần tặng xe scooter hoặc balo kéo đặt_hàng chương_trình nhận hàng tã quà khuyến_mãi đặt_hàng 78 mong xem_xét dùm,0,0,0,0,1,0,0
4260,thấm hút tốt loại tã mỏng dùng bé đi chơi hoặc ngủ trưa phù_hợp,0,0,0,1,0,0,0
4261,bỉm mỏng nhẹ thích_hợp dùng ban_ngày,0,0,0,1,0,0,0
4262,giao hàng nhanh sản_phẩm đúng mẫu mua hàng tiếp_tục km,1,0,0,0,1,0,0
4263,hàng chất_lượng tả xài ok bảo_quản tốt bao_bì cũ hay rách ảnh_hưởng đến chất_lượng sp,0,0,0,1,1,1,0
4264,bỉm quần dính bông da bé thấm hút đc tốt bỉm dán goon,0,0,0,1,0,0,0
4265,pamper luôn tuyệt_vời,0,0,0,0,0,0,1
4266,đóng_gói dán băng keo bịch bỉm muốn gỡ hư luôn bịch,1,0,0,0,0,0,0
4267,giao hang nhanh san pham đúng nhu mô ta đog goi cân thân,1,0,0,0,0,0,0
4268,sản_phẩm chống nắng vật_lý chất tạo mùi da thẩm_thấu nhanh làm da sáng bình_thường chống thấm nước gây bít lỗ_chân_lông thời_tiết nóng hiệu_quả chống nắng tuyệt_vời mặc_dù chỉ_số cao,0,0,0,0,0,0,0
4269,đặt mua gói tả cận tết lu_bu kiểm_tra tới tết khu sử_dụng mới phát_hiện giao gói tả,0,0,0,0,1,0,0
4270,giao hàng nhanh dự_kiến bỉm thấm hút tốt form thoải_mái,1,0,0,1,0,0,0
4271,tã giao nhanh_chóng sạch_sẽ hài_lòng,1,0,0,0,0,1,0
4272,sản_phẩm tốt giao hàng nhanh ‍ ️ đóng_gói cẩn_thận,1,0,0,0,0,0,0
4273,lyoon tin_dùng hg con nay tuổi năm,0,0,0,0,0,0,1
4274,đầu nhận quà kinh_khủng túi đựng chó mèo lấy đem làm_quà khách làm_ăn tâm chút đi,0,0,0,0,1,0,0
4275,khác tã ngày thậm_chí nhanh thay tã,0,0,0,1,0,0,0
4276,đặt tã quần size m giao nhầm tã dán nay xài hết 4 bịch mới phát_hiện giá loại này_khác nhau mong con cưng kiểm_tra hàng giao hàng đặt_để bù số tiền chênh_lệch,0,0,0,0,1,0,0
4277,sản_phẩm tốt giao hàng đúng hẹn nói_chung hài_lòng,1,0,0,0,0,0,0
4278,giao hàng nhanh giá hợp_lý đóng_gói đẹp chắc_chắn,1,1,0,0,0,0,0
4279,giao hàng nhanh uy_tín ta giá tốt chất_lượng đảm_bảo dùng hợp bé nhà_minh,1,1,0,1,0,0,0
4280,tã bé dùng hăm,0,0,0,0,0,1,0
4281,hài_lòng balo vải thô cứng đẹp_mắt đường may chắc_chắn rộng_rãi ngờ 102 ngàn món luôn ưng cảm_ơn đầu mua tưởng balo à mở ba bốn luôn màu đt chụp mờ ở ngoài hồng đẹp ạ,0,0,0,0,0,0,0
4282,bảo mua 300k dc tặng túi trang_điểm mẹ chẳng đâu tặng bộ chén dĩa vỡ mất chén làm thất_vọng đâu yêu_cầu gửi mặt_hàng dễ vỡ đóng_gói chặt_chẽ kèm niêm_phong hàng dễ vỡ bên vận_chuyển người ta biết nhẹ_tay,0,0,0,0,1,0,0
4283,giá rẻ free ship quà tặng,1,1,0,0,1,0,0
4284,hài_lòng về sản_phẩm cửa_hàng thái_độ phục_vụ khách_hàng đội_ngũ nhân_viên tốt,0,0,0,0,1,0,0
4285,hài_lòng bé nhà hợp bỉm ủng_hộ tiếp,0,0,0,0,0,0,1
4286,dùng ổn ạ phần chun êm huggies giá mềm ok dùng đêm đến sáng ẩm mông bé ạ,0,1,0,1,0,0,0
4287,tã mềm thấm hút tốt hằn giao hàng nhanh đặt chiều hôm sáng hôm giao hàng dù ở tỉnh_lẻ khuyến_mãi 3 gói nhỏ 12 miếng tiện_lợi,1,0,0,1,1,0,0
4288,bỉm mặc ok tràn vón cục bé ngủ vô_tư tối đến sáng lo thấm giường,0,0,0,1,0,0,0
4289,giá ưu_đãi tốt giao hàng nhanh check mã_vạch,1,1,1,0,0,0,0
4290,gia ca ok su dung ok giao hang nhanh tiet kiem phi ship,1,1,0,1,0,0,0
4291,bán hàng chuẩn tã mỏng mềm thấm hút tốt bé 12kg 75cm to_con dùng xxl thoải_mái,0,0,1,1,0,0,0
4292,tạm đc giao hàng nhanh mới đặt chiều thứ 7 chủ_nhật giao hài_lòng chế_độ phục_vụ,1,0,0,0,1,0,0
4293,giao hàng nhanh sp chất_lượng,1,0,0,1,0,0,0
4294,mới nhận sữa hôm thứ 09 09 bạn giới_thiệu mua dùng thử chất_lượng tuyệt_vời bột sữa mịn thơm màu vàng đẹp vị ngọt béo thơm ngon dùng thử quyết_định đổi sang dùng sữa non colosbaby luôn,0,0,0,1,0,0,0
4295,giao hàng nhanh chất_lượng sản_phẩm tuyệt_vời ông mặt_trời,1,0,0,1,0,0,0
4296,giao hàng nhanh gói hàng cẩn_thận tuy_nhiên sản_phẩm ưng_ý lắm,1,0,0,0,0,0,0
4297,mua hồng xanh dương đậm balo cứng_cáp tiện_lợi đẹp y hình đáng mua,0,0,0,0,0,0,0
4298,sản_phẩm tốt đúng mô_tả,0,0,0,0,0,0,1
4299,giao hang nhanh đòng goi cẩn_thận giá tốt thanks,1,1,0,0,0,0,0
4300,bé nhà dùng loại hăm giá đắt mấy loại thường,0,1,0,0,0,1,0
4301,hài_lòng con thích cảm_ơn,0,0,0,0,0,0,1
4302,chất_lượng sản_phẩm tốt chun quần thế_hệ mới bé mặc lằn thời_gian giao hàng nhanh ủng_hộ,1,0,0,1,0,0,0
4303,giao hàng nhanh đúng mẫu đặt balo to đẹp đựng đồ đường may chắc_chắn ngăn chi_tiết tiện_dụng thực_sự hài_lòng hy_vọng dùng bền thanks nhà_cung_cấp,0,0,0,0,0,0,0
4304,sản_phẩm tệ thấm hút kém tã mùi băng_vệ_sinh tí nước_tiểu dính người bé dù giá rẻ bao_giờ mua tã nhàu,0,1,0,1,0,1,0
4305,giao hàng nhanh đóng_gói cẩn_thận ủng_hộ,1,0,0,0,0,0,0
4306,hai_long kkkkkkkkkkkkkkkkkkk,0,0,0,0,0,0,0
4307,san pham xai rat ok toi hai_long ve san pham nay,0,0,0,1,0,0,0
4308,tả dùng thấm hút tốt đũng rộng thoáng em bé đóng_gói chắc_chắn giao hàng nhanh,1,0,0,1,0,0,0
4309,bỉm ok mỏng thấm hút tốt miếng kéo dán quấn bỉm vứt đi ok,0,0,0,1,0,0,0
4310,hàng đóng_gói sơ_sài ship hàng gọi điện,1,0,0,0,0,0,0
4311,hàng trading ưng_ý,0,0,0,0,0,0,1
4312,bỉm mới dùng huggies bé sinh đến giờ mua yên_tâm giá_cả cạnh_tranh siêu_thị tạp_hoá giao hàng tận thật thích,1,1,0,0,0,1,0
4313,bịch tả rách chỗ hy_vọng nhiễm_khuẩn rách thế_này hy_vọng rách như_thế,0,0,0,0,1,1,0
4314,giao hàng nhanh đóng gọi cẩn_thận,1,0,0,0,0,0,0
4315,tã size nhỏ loại dùng trước_đây bé,0,0,0,0,0,0,1
4316,giao nhanh đóng_gói kỹ,1,0,0,0,0,0,0
4317,bé 8kg mặc size l lằn đỏ hết lưng,0,0,0,1,0,0,0
4318,sản_phẩm dùng ok hợp túi_tiền,0,1,0,1,0,0,0
4319,thấm hút tốt bằng hugggi giá_cả rẻ hâm hay thay tốn_kém bao_nhiêu,0,1,0,1,0,1,0
4320,dùng bỉm moony con lâu hài_lòng sản_phẩm now thật tốc_độ,1,0,0,0,0,0,0
4321,sữa pha nổi váng cợn li_ti đề_nghị đổi sản_phẩm khác,0,0,0,1,0,0,0
4322,sản_phẩm tốt giao hành nhanh date mới,1,0,0,0,0,1,0
4323,bé gái mặc thoải_mái khô thoáng kg ẩm tốt,0,0,0,1,0,0,0
4324,đặt 7h sáng 12h giao hàng dù dùng tikinow xuất_sắc,1,0,0,0,0,0,0
4325,hàng chính hãng giá tốt,0,1,1,0,0,0,0
4326,ở sóc_trăng giao hàng dc,0,0,0,0,1,0,0
4327,hình sản_phẩm tặng 8 miếng giao hàng tặng,0,0,0,0,1,0,0
4328,sản_phẩm chất_lượng shiper nhiệt_tình,1,0,0,1,0,0,0
4329,đổi bịch size m thành size l nha bé nhà mac chật,0,0,0,0,0,0,1
4330,san pham chuan hang chinh hang rat tot se mua lan toi,0,0,1,0,0,0,0
4331,đơn hàng t mua bịch bỉm tặng bobby chan giao đơn hàng bịch bỉm 214751081 719322124 đơn hàng quà tặng huỷ 783938058 259323062 t liên_hệ trả_lời đơn hàng huỷ đơn_vị giao hàng liên_hệ giao hàng ngày 167 t tắt máy trả hàng thật vô_lý số điện_thoại địa_chỉ bên đơn_vị giao hàng nijavan giao thành_công bên huỷ đơn_vị vận_chuyển khác giao hàng 3 trong 3 ngày khác nhau thành_công mới huỷ tại_sao bên vận_chuyển mới liên_hệ huỷ hàng hay đơn hàng quà tặng mới như_vậy nhờ đơn hàng t bàn_giao đơn_vị vận_chuyển khác trừ nhân_viên ạ,0,0,0,0,1,0,0
4332,hàng đóng_gói cẩn_thận bộ_đồ nous vải đẹp thoáng mát cảm_ơn,1,0,0,1,0,0,0
4333,chất_lượng sp tốt giá rẻ hài_lòng sp tiếp_tục mua,0,1,0,1,0,0,0
4334,đặt mua km mua combo đc tặng kèm phao bơi bé mua combo nhận đc spham khuyến_mãi đính kèm thường mua hàng thực_sự hài_lòng,0,0,0,0,1,0,0
4335,sản_phẩm tốt giao hàng sp nhanh quà tặng giao thành gói khác sp trẻ tuổi đi tặng xúc_xắc hài_lòng về quà lắm,1,0,0,0,1,0,0
4336,sp loại bình sữa nhật combie como nhà 3 loại bình bình hiểu sp loại bình chất_liệu nhựa mùi nồng nghĩ ủ sữa bằng bình khả_năng an_toàn,0,0,0,0,0,0,0
4337,hàng chuẩn chính hãng huggies hỗ_trợ dịch_vụ tikinow giao nhanh trong ngày tôi hài_lòng sản_phẩm dịch_vụ,1,0,1,0,0,0,0
4338,ok giá rẻ,0,1,0,0,0,0,0
4339,sp rẻ thấm hút tốt vón cục mua nh,0,1,0,1,0,0,0
4340,chất_lượng sản_phẩm tuyệt_vời y_như mô_tả,0,0,0,1,0,0,0
4341,mỏng thể_nào mỏng thô_ráp mềm dùng lau nồi cơm lau chén bát chắc hợp lau mặt em bé hợp,0,0,0,0,0,0,0
4342,tã mỏng thấm hút tốt chứa dc km giá rẻ tiếp_tục ủng_hộ,0,1,0,1,0,0,0
4343,sp tốt khuyến_mãi giá tặng kèm gối cừu mây cực đẹp mịn,0,1,0,0,1,0,0
4344,rẻ chất_lượng ổn loại tả dùng ban_ngày thông_thường mẹ lưu_ý vòng đùi tăng size thay_vì quan_tâm số kg lựa_chọn,0,1,0,1,0,0,0
4345,đóng_gói tốt sữa thơm ngon con thích uống,1,0,0,1,0,0,0
4346,vải mềm con mặc thoải_mái mặc đi ngoài chơi phù_hợp dáng quần dài làm chật quần ngoài quần bỉm lệch sang bên,0,0,0,0,0,0,0
4347,sử dung một sản_phẩm hữu_ích mua cám_ơn bán san phẩm,0,0,0,0,0,0,1
4348,sữa bàn hàng tặng kèm dễ_thương tiếc xíu dây đeo túi_xách mẹ dài hình,0,0,0,0,1,0,0
4349,bỉm chính hãng nhưg biết vận_chuyển hay nhưg rách bao_bì m để_ý nhận hàng song sippers đi mói,0,0,1,0,1,0,0
4350,tặng balo đơn hàng nhận,0,0,0,0,1,0,0
4351,giao hàng đúng hẹn nhg giao ghế gọi hotline nhân_viên bảo gọi đến h gọi cskh kém,0,0,0,0,0,0,0
4352,giao hàng nhanh_chóng đóng_gói cẩn_thận sản_phẩm tốt,1,0,0,0,0,0,0
4353,hàng giống hình chất_lượng xài mới bt an,0,0,0,0,0,0,1
4354,bao y_chang hình chất_liệu tốt có_vẻ bền cảm_ơn,0,0,0,0,0,0,0
4355,m hạn sử_dụng sản_phẩm nhờ bạn tư_vấn giúp ạ,0,0,0,0,0,1,0
4356,giao hàng nhanh goi hàng kĩ luôn,1,0,0,0,0,0,0
4357,sản_phẩm ok đăng quảng_cáo mua 3 gói tặng gấu bông đến ngày nhận đc hàng tặng thất_vọng,0,0,0,0,1,0,0
4358,giao hàng nhanh hàng đúng chuẩn,1,0,1,0,1,0,0
4359,giao hàng nhanh dự_kiến sản_phẩm chất_lượng date mới,1,0,0,1,0,1,0
4360,bịch nặng dã_man sử_dụng đánh_giá,0,0,0,0,0,0,1
4361,minh moi dung be nha 10 5kg mih mua size xl mac khoang tieng vết hằn vay co me nao nhu mih hk,0,0,0,1,0,0,0
4362,dung tam duoc,0,0,0,1,0,0,0
4363,sản_phẩm nói_chung quá_khứ giáo hàng nhanh,1,0,0,0,0,0,0
4364,giao hàng nhanh đóng_gói cẩn_thận giá_cả okue nha mẹ,1,1,0,0,0,0,0
4365,sản_phẩm đúng bao_bì cũ dính bẩn,0,0,0,0,1,1,0
4366,đáng mua lắm nha mẹ,0,0,0,0,0,0,1
4367,tã mua thứ nhất đúng giá ghi thứ phí 19k tới chọn đặt_hàng xong tổng_cộng 810k hả,0,1,0,0,0,0,0
4368,bỉm mỏng mềm dùng mk chưa_thể đánh_giá cbi giao hàng lâu,1,0,0,1,0,0,0
4369,giao hàng nhanh bỉm chất_lượng thấm hút tốt,1,0,0,1,0,0,0
4370,sản_phẩm tốt lắm,0,0,0,0,0,0,1
4371,e đặt mua 2g size xl app báo đơn hàng giao thành_công hàng e nhận e đặt đơn khác bên xem_lại phần làm mất tg kh,0,0,0,0,1,0,0
4372,hài_lòng về đặt đơn hàng mới ngày 4 11 hy_vọng nhận hộp móp méo cảm_ơn,0,0,0,0,1,0,0
4373,sp tot gia ca lai re voi thi truong minh sd hag thag luon,0,1,0,0,0,0,0
4374,chất_lượng hàng ok tuy_nhiên đặt combo 3 bịch viết quà kèm thời_điểm thị_trường quà thú bông gửi kèm,0,0,0,1,1,0,0
4375,hoi gio hon mau cu tham hut wa gio,0,0,0,1,0,0,0
4376,meries hoặc moony pamper nhỏ size ai xài xen kẻ giống hoặc đổi bỉm bé nhớ chọn lớn size độ thấm hút ngạc_nhiên luôn ngang_ngửa meries moony mỏng giá_thành rẻ gấp đôi ý 10 chất_lượng,0,1,0,1,0,0,0
4377,sản_phẩm tốt đóng_gói kỹ giao hàng nhanh ủng_hộ mua tiếp,1,0,0,0,0,0,0
4378,giao hàng nhanh date mới tã mỏng mềm thấm hút ổn,1,0,0,1,0,1,0
4379,sản_phẩm tốt chính hãng bé mặc thoải_mái thanks,0,0,1,1,0,0,0
4380,đúng quảng_cáo,0,0,0,0,0,0,1
4381,cực_kỳ hài_lòng,0,0,0,0,1,0,0
4382,sài mỏng thấm vón cục,0,0,0,1,0,0,0
4383,sản_phẩm chính hãng giao hàng siêu nhanh mất phụ_phí sản_phẩm apply promotion code giá tốt,1,1,1,0,0,0,0
4384,bao_bì bụi bẩn tã thấm hút tốt,0,0,0,1,0,1,0
4385,sữa date xa dễ uống,0,0,0,1,0,1,0
4386,tả thấm hút tốt cực hài_lòng sản_phẩm pampers mới,0,0,0,1,0,0,0
4387,sản_phẩm đóng_gói cẩn_thận tôi hài_lòng nhận hàng,1,0,0,0,0,0,0
4388,bỉm dùng tốt giá ổn giao hành nhanh đóng_gói cẩn_thận,1,1,0,1,0,0,0
4389,hàng tốt giá_cả phải_chăng,0,1,0,0,0,0,0
4390,chán thật_sự size s 4 8kg cảm_giác size dành bé sơ_sinh 3kg bỉm thỳ cực mỏng măc tiéng chắc thay mất chất_lượng chán,0,0,0,1,0,0,0
4391,giao hàng nhanh đóng_gói ổn,1,0,0,0,0,0,0
4392,sp ok nè nhân_viên giao hàng dễ_thương,1,0,0,0,0,0,0
4393,rắc_rối vài options nhận_xét nhanh khách chọn bạn it làm form xem_lại kiến_thức về user friendly vd người lớn_tuổi rành về gõ tiếng việt dấu viết nhận_xét thế_nào muốn đi tiếp kiếm supervisor tốt chút đừng lấy hiểu_biết bạn áp_đặt khách_hàng,0,0,0,0,0,0,0
4394,đựng đồ,0,0,0,0,0,0,0
4395,tã giao rách băng keo dán tùm_lum sản_phẩm cũ,0,0,0,0,1,1,0
4396,hàng chất_lượng đẹp giá tốt,0,1,0,1,0,0,0
4397,giao nhanh uy tin chất_lượng mua hàng bên đều_đều hi,1,0,0,1,1,0,0
4398,mua gọi cuc dai size l 54 co tang gi het,0,0,0,0,1,0,0
4399,quà tặng quảng_cáo,0,0,0,0,1,0,0
4400,dong goi san pham dep sua date xa,1,0,0,0,0,1,0
4401,xài ok mua 4,0,0,0,1,0,0,0
4402,giao hàng củ,0,0,0,0,1,0,0
4403,giao hàng nhanh cảm_thấy hài_lòng giá rẻ shopee,1,1,0,0,0,0,0
4404,mua ok,0,0,0,0,0,0,1
4405,sờ cảm_giác mỏng hàng mua ở đại_lí gần nhà ng phản_ánh như_vậy r tại_sao,0,0,0,0,0,0,1
4406,giao hang lâu,1,0,0,0,0,0,0
4407,thay ta cung ok nhin rat dep hi vong xai se on va chat luong,0,0,0,0,0,0,1
4408,sản_phẩm may đẹp hoạ_tiết dễ_thương hài_lòng,0,0,0,0,0,0,1
4409,tả mỏng dễ_thương con tè dùng ban_ngày hợp,0,0,0,1,0,0,0
4410,sữa nguyên tem date mới tặng_phẩm ủng_hộ dài_dài,0,0,1,0,1,1,0
4411,sp giao đúng hẹn đúng loại chất_lượng đảm_bảo tiếp_tục ủng_hộ,1,0,0,1,1,0,0
4412,sản_phẩm giống mô_tả đặt màu hồng xám giao nguyên màu hồng túi gia_công cẩu_thả nhãn_mác giống ảnh chụp loại gửi giá rẻ giá giảm,0,0,0,0,1,0,0
4413,to thoải_mái màu đẹp trông xịn xò,0,0,0,1,0,0,0
4414,hang cua sai cực_kì hai log se ug ho,0,0,0,0,0,0,1
