,text,aspect1,aspect2,aspect3,aspect4,aspect5,aspect6,aspect7
2885,sản_phẩm phù_hợp giá tiền mọi người mua hình_ảnh mang tính_chất hoàn xu,0,1,0,0,0,0,0
2886,hsd xa đóng_gói cẩn_thận giao lâu,1,0,0,1,0,1,0
2887,giao hàng nhanh_chóng giá_cả phù hợppppppppppppppppppppp,1,1,0,0,0,0,0
2888,mua hàng hài_lòng đóng_gói kỹ giao nhanh date xa,1,0,0,0,0,1,0
2889,sản_phẩm móp giao hàng nhanh đạt hôm hôm sữa pha váng trắng,1,0,0,1,0,1,0
2890,ưng sản_phẩm luôn mã giảm_giá nhập đc hjc,0,0,0,0,0,0,1
2891,giao hàng siêu nhanh,1,0,0,0,0,0,0
2892,giao hàng nhanh balo tặng ok quả đóng_gói thất_vọng shopee mall hàng ảnh_hưởng đóng_gói bên trong sơ_sài hãng sữa khác m mua trc,1,0,0,0,1,0,0
2893,chất_lượng sp tốt xứng giá tiền cám_ơn lắm dành ng tiêu_dùng chúng_tôi sản_phẩm chất_lượng giá đẹp như_vậy ủng_hộ tiếp thank youuuii,0,1,0,1,0,0,0
2894,hộp va_đập mạnh vận_chuyển,1,0,0,0,0,0,0
2895,nhận hàng giao hàng nhanh đóng_gói chắc_chắn,1,0,0,0,0,0,0
2896,nhận hàng đóng_gói chắc_chắn hộp sữa móp méo hết giá_cả rẻ tiếp_tục ủng_hộ thanks nè,1,1,0,0,0,0,0
2897,em chuyên hàng sỉ lẻ đồ_hàng thùng hịn mn face hoac inbox em tìm hàng ưng_ý,0,0,0,0,0,0,0
2898,lúc_nào chuẩn_bị bên giao hàng nhanh cơn gió bỉm mỏng mềm con dùng bé hăm giá siêu tiết_kiệm,1,1,0,1,0,0,0
2899,bỉm ok mềm_mỏng mịn giao siêu nhanh,1,0,0,1,0,0,0
2900,giao hàng nhanh mk mua bịch gold night luôn dùng bgio tay cầm mềm mịn,1,0,0,1,0,0,0
2901,sữa móp méo hài_lòng,1,0,0,0,0,0,0
2902,hàng đóng_gói kỹ_càng nhân_viên bên tương_tác khách,1,0,0,0,1,0,0
2903,nhắn đóng_gói cẩn_thận làm túi ni lông hộp méo,1,0,0,0,0,0,0
2904,hạn_dùng xa 2022 giao hàng nhanh tuy_nhiên đợt về móp hộp nhe xem_lại cách đóng_gói ơi,1,0,0,0,0,1,0
2905,mua nhầm tã dán huhu nhưg bỉm okie dùng,0,0,0,1,0,0,0
2906,sản_phẩm tốt date 2022 đóng_gói cẩn_thận tiếp_tục mua hàng,1,0,0,1,0,1,0
2907,trong vật_lý photon tiếng việt đọc phô tông hay phô tôn hay quang tử một hạt_cơ_bản đồng_thời hạt lượng_tử trường điện ánh_sáng mọi dạng bức_xạ điện khác nó hạt tải lực lực điện hiệu_ứng lực điện dễ_dàng quan_sát ở thang vi_mô,0,0,0,0,0,0,0
2908,sữa ổn bé nhà hợp_tác dùng hết ok mua ủng_hộ tiếp,0,0,0,1,0,0,0
2909,giao hàng nhanh sữa ok đóng_gói đẹp,1,0,0,1,0,0,0
2910,giao hàng nhanh đóng_gói cẩn_thận hiểu móp một_chút ạ,1,0,0,0,0,0,0
2911,hình_ảnh kiếm xu thôi nhednvgkkggyuuhhvvvvhhgfdtgggff,0,0,0,0,0,0,0
2912,sp ok ship nhanh cmzkakallwksnwksofjsosndjowhdjebdhdbjxjxjxjskekixjxjxjxjxjdjrjj b hxjdnjxj nfhfjjzozozbzoal jwj xodok kxoqvfxvc kqo,1,0,0,1,0,0,0
2913,nt ở zalo nhờ bọc xốp cẩn_thận sợ móp mua tặng thế_mà giao hàng may_mà móp chắc hoàn hàng,1,0,0,0,1,0,0
2914,bé uống bé hợp sữa mua tiếp,0,0,0,0,0,0,0
2915,một lý_do tới khui hạn đổi trả what the hell,1,0,0,0,0,0,1
2916,mua biết bn rôìm mua hộ kua mh ai ưng quà tặng thích lắm ạ,0,0,0,0,1,0,0
2917,gửi hàng nhanh đóng_gói cẩn_thận bỉm mịn_màng thấm hút tốtxxc,1,0,0,1,0,0,0
2918,mua mấy ok dhdjjfhdhdhdjdjdhhdjdjdjjdjdjfjnfnfnfnfnbf,0,0,0,0,0,0,0
2919,đóng_gói cẩn_thận mua fs dc giá tốt giao thiếu dù_sao gq hoàn tiền kh r,1,1,0,0,1,0,0
2920,bé nhà toàn dùng sữa giá rẻ chỗ khác hàng toàn giao nhà,1,1,0,0,0,0,0
2921,sữa chuẩn mua trc giao hàng bằng now ship siêu nhanh,1,0,1,0,0,0,0
2922,chuẩn_bị nhanh nhận hàng nhanh_chóng nhìn hàng chuẩn,1,0,1,0,0,0,0
2923,thời_gian giao hàng nhanh đóng_gói sp chắc_chắn tiếp_tục ủng_hộ,1,0,0,0,0,0,0
2924,luôn như_thế hàng giao nhanh date 2022 mô_tả ủng_hộ dài_dài,1,0,0,0,0,1,0
2925,nhận dc hàng giao hàng nhanh đóng_gói hàng cẩn_thận cảm_ơn chuc buon may bán đẳt,1,0,0,0,0,0,0
2926,giao hàng nhanh đóng_gói cẩn_thận hạn xa dùng ok ủng_hộ dài,1,0,0,0,0,1,0
2927,giao hàng lâu đóng hàng cẩn_thận sữa xịn giá tốt,1,1,0,1,0,0,0
2928,toàn hàng date kém,0,0,0,0,0,1,0
2929,giao hàng nhanh đóng_gói chắc_chắn tư_vấn nhiệt_tình chất_lượng tốt ủng_hộ lâu_dài,1,0,0,1,1,0,0
2930,sản_phẩm tốt đóng_gói chắc_chắn,1,0,0,1,0,0,0
2931,hàng oki phục_vụ tốt nhiệt_tình ủng_hộ zxxxx,0,0,0,1,1,0,0
2932,mua hàng chắc mấy sản_phẩm giống mấy trc ok sử_dụng,0,0,0,1,0,0,0
2933,mua sữa bọc cẩn_thận vs sốp,1,0,0,0,0,0,0
2934,đóng_gói sơ xài sữa nhận hộp móp te_tua bực lắm lun,1,0,0,0,0,0,0
2935,nhiệt_tình giao hàng nhanh sử_dụng biết chất_lượng rẻ khác,1,1,0,0,1,0,0
2936,giao hàng siêu nhanh đóng_gói chắc_chắn likeeeeeeeeeeeeee,1,0,0,0,0,0,0
2937,tư_vấn nhiệt_tình đóng_gói cẩn_thận có_điều hàng giao lâu sữa thơm,1,0,0,1,1,0,0
2938,ship mắc ạ huhu bên shopee hỗ_trợ hay nhỉ,1,1,0,0,0,0,0
2939,sữa vón khó tan mua suabim vn hơn_nữa mùi thơm bằng pha sữa xong nổi váng nói_chung thể ham rẻ mua chênh nhau 100k cảm_giác đảm_bảo,0,1,0,1,0,1,0
2940,đầu_tiên mua nhận hộp sữa méo_mó date đc xa đc hài_lòng lắm,1,0,0,0,0,1,0
2941,hàng giao đúng date mới hợp_lệ 4 ngày canh khuyến_mãi giá tốt,0,1,1,0,0,1,0
2942,nhắn giao luôn giao ship cơn gió ạ thanks,1,0,0,0,0,0,0
2943,hàng chata lượng giá rẻ ủng_hộ dài_dài,0,1,0,1,0,0,0
2944,mua nhièu hàng chính hangz yên_tâm giao hàng siêu nhanh mua nhièu hàng chính hangz yên_tâm giao hàng siêu nhanh,1,0,1,0,0,0,0
2945,sp tốt,0,0,0,0,0,0,1
2946,mua đc sữa rẻ đc quà cảm_ơn bé uống lâu_lâu tuy tăng cân trv bé thích uống sữa,0,1,0,0,1,0,0
2947,ok bdbhdhdhdhdhdhbdbdbdnkrnfnnfnfnfnfnfnfnfnndnfnfnfnnfnfnfnfnfnfnkfnffnnfnfnfnnfnrmrmrmrnnrnrndnfnnfnfnfnff nfnfnmfmfnffn,0,0,0,0,0,0,0
2948,hàng giao nhanh sản_phẩm đúng số tiền bỏ mua good good,1,1,0,0,0,0,0
2949,gói hàng cẩn_thận,1,0,0,0,0,0,0
2950,mua lần_lần ưng đóng_gói chắc_chắn ủng_hộ,1,0,0,0,0,0,0
2951,sữa thơm giá rẻ mong hàng chuẩn giờ thị_trường lẫn_lộn sợ sữa thơm giá rẻ mong hàng chuẩn giờ thị_trường lẫn_lộn sợ,0,1,0,1,0,0,0
2952,thứ nhận quà khuyến_mãi thiếu món đầu xe 3 bánh con bọ thiếu cây sắt gắn bánh_xe phía bộ lèo xếp bệnh_viện ghi 60 món thiếu hét mấy miếng to quà khuyến_mãi đánh_đố tâm hết,0,0,0,0,1,0,0
2953,mua để_dành giờ bé rụng răng,0,0,0,0,0,0,0
2954,tả xài thích thấm hút tốt hâm giao hàng đóng hói cẩn_thận hài_lòng về sản_phẩm,1,0,0,1,0,1,0
2955,gói bỉm cũ bạc_màu loại mẫu_mã lâu gói bỉm rách,0,0,0,1,0,1,0
2956,đóng_gói kỹ tả thấm hút tốt đai thun co_giãn chặc bé xài tả nãy tiết_kiệm huggies platinum 3kmiếng,1,0,0,1,0,0,0
2957,sai cung duoc,0,0,0,0,0,0,1
2958,giao hàng dự_kiến hàng tốt chính hãng cám_ơn,1,0,1,1,0,0,0
2959,size m nhung nhỏ p mua size,0,0,0,0,0,0,1
2960,sữa con uống tốt tăng chiều cao cân nặng tiêu_hoá bé tốt,0,0,0,1,0,0,0
2961,giao hàng nhanh đúng loại hình đc tặng 8m loại size s phù_hợp số cân nặng 4 8 kg bé nhà 5 5kg mặc rộng phần đai dán mềm_mại dính tốt loại bobby soft màu vàng size bé đai dán cứng chật làm_bé hằn hết chẳng soft ở chỗ mặc_dù mua loại size s,1,0,0,1,0,0,0
2962,mua thứ r bé xài êm cáo bông dễ_thương,0,0,0,1,1,0,0
2963,mua hàng đầu_tiên thất_vọng bao_bì sp cũ xấu hàng hết hạn sd ý mở bên trong sd nhũn thích mọi mua ngoài cửa_hàng thất_vọng,0,0,0,1,0,1,0
2964,sản_phẩm tốt ️ ️ ️ ️ ️ ️ ️ ️ ️,0,0,0,0,0,0,1
2965,bé nhà mới 8 kí mặc vô lằn đỏ hết hai bên hông bỉm nhỏ_bé mặc thoải_mái,0,0,0,1,0,0,0
2966,ok trong tầm giá,0,0,0,0,0,0,1
2967,lô hàng ưu_điểm hình bỉm ngộ_nghĩnh thay_đổi đa_dạng tạo hứng_thú bé nhược_điểm thấm hút kém lô hàng dễ tràng bỉm,0,0,0,1,0,0,0
2968,mặc bí chat luong thi ok,0,0,0,1,0,1,0
2969,dùng ok cảm_ơn se ung ho tiep,0,0,0,1,0,0,0
2970,đóng_gói cẩn_thận hàng tốt,1,0,0,1,0,0,0
2971,59k co balo đẹp hú hôn,0,0,0,0,0,0,0
2972,tã mỏng tã mua bên ngoài mùi thơm nặng trong tã mua bên ngoài mùi cảm_giác sử_dụng tã mua bên ngoài an_toàn dễ_chịu dùng tã,0,0,0,1,0,0,0
2973,bé nhà xài tã bobby nhỏ thun co_giãn tốt chống hăm bán hay giảm_giá quà gói now giao hàng cực_kỳ nhanh thích,1,1,0,1,1,1,0
2974,nhận vết dơ ở góc balo tiện_lợi ngăn nhỏ đồ trẻ nhất_là ngăn giữ ấm dùng giữ sữa con bỏ sữa giữ ấm tiếng dĩ_nhiên nguội bớt đi ấm ấm bé dùng thank,0,0,0,0,0,0,0
2975,tã fom dáng rộng bé mặc thoải_mái tã cứng vs giá_như gù chê ít_nhất thương_hiệu dùng an_tâm bỉm trần,0,1,0,1,0,0,0
2976,sp dùng thích tốt mua ba muốn tiếp_tục ủng_hộ,0,0,0,1,0,0,0
2977,đóng_gói gọn combo 3 gói giá hài_lòng,1,1,0,0,0,0,0
2978,ngày dùng huggies chẳng lăng tăng đi chọn mẫu tã mới tã huggie dùng thích nay mẫu mới thiết_kế lưng thun 4 chiều cực thích bé dùng bì hằn đỏ mềm_mại ôm sát bụng giúp bé thoả mái vận_động sợ đau rát hay tràn ngoài nay đùi êm nha 5 đệm mây vận_chuyển nhanh thanks,1,0,0,1,0,0,0
2979,đặt_hàng màu trắng đỏ giao hàng màu xanh đậm balo dành đựng quần_áo giống sản_phẩm trong trang_web toàn lừa_đảo,0,0,0,0,0,0,0
2980,mua bé nhà giá_cả phải_chăng đóng_gói cẩn_thận giao hàng nhanh,1,1,0,0,0,0,0
2981,bỉm thấm hút kém dễ tràn mặc loại bỉm khác mặc bỉm bobby y_như ràng tràn dính quần mặc_dù bỉm đầy vần tràn thậm_chí mới mặc em ị tràn r dùng dùng bực tiếc tiền kinh_khủng,0,0,0,1,0,0,0
2982,sữa ngọt dịu mùi thơm bé dễ uống dễ tiêu_hoá bán giá rẻ coupon giảm_giá thích cảm_ơn,0,1,0,1,1,0,0
2983,sp tốt hài_lòng mua,0,0,0,0,0,0,1
2984,0k date mới nha mn mua nha mn tuyệt,0,0,0,0,0,1,0
2985,trong deal nói tặng một thố lock lock gứi hàng giải_thích dùm,0,0,0,0,1,0,0
2986,chất_lượng ok,0,0,0,1,0,0,0
2987,đóng_gói kĩ hàng chất_lượng uy_tín nói,1,0,1,1,0,0,0
2988,ghi tặng hươu_cao_cổ gửi về kèm sữa con thú khác đúng j quảng_cáo,0,0,0,0,1,0,0
2989,sản_phẩm tốt thấm hút tốt gọn_nhẹ chất_lượng cao,0,0,0,1,0,0,0
2990,sp dùng êm,0,0,0,1,0,0,0
2991,hàng chính hãng chất_lượng giá rẻ giao hang nhanh se tiếp_tục mua,1,1,1,1,0,0,0
2992,hàng kém chất_lượng thất_vọng,0,0,0,1,0,0,0
2993,giao hàng nhanh đóng_gói sản_phẩm cẩn_thận tã dán nb huggies mềm dùng bé sơ_sinh ok,1,0,0,1,0,0,0
2994,giao hàng nhanh giay tốt đúng mô_tả ủng_hộ,0,0,0,0,0,0,0
2995,giao hàng đúng ngày minh mua giá tốt sản_phẩm tốt,1,1,0,1,0,0,0
2996,bé hâm lưng hằn vết sử_dụng ngược_lại mỏng mau đầy sản_phẩm loại một đêm bé tiêu,0,0,0,1,0,1,0
2997,mua combo 3 bịch bỉm đại giao hàng nhanh hôm đặt tặng kèm bộ_đồ chơi tàu_hoả bằng gỗ nhận hàng,1,0,0,0,1,0,0
2998,bỉm thấm hút tốt dùng bỉm quần bé lằn tã dán ok,0,0,0,1,0,0,0
2999,thấm hút tốt giá tốt quà tặng sfjmmnfxhj,0,1,0,1,1,0,0
3000,bé nhà nhỏ chủ_yếu dùng huggies tuy_nhiên thích mùi tã nồng,0,0,0,1,0,0,0
3001,giao nhanh ngày dự_kiến,1,0,0,0,0,0,0
3002,mua 3 bịch bỉm thanh_toán đủ tiền quà nhận đủ bỉm giao thiếu bịch gọi đt tổng_đài đợi chuyển trả bịch bỉm,1,0,0,0,1,0,0
3003,giao hàng cực nhanh đóng_gói chắc_chắn good,1,0,0,0,0,0,0
3004,bữa_nay đóng_gói xấu mới nhận biết bên trong,1,0,0,0,0,0,0
3005,bỉm thoáng mỏng cảm_giác bé mặc dễ_chịu tè ít khô_ráo tuy_nhiên bỉm mỏng phù_hợp bé tè về đêm sáng dậy bỉm bõng bõng nước tràn ngoài bé 9kg bắp_đùi to mặc size xl,0,0,0,1,0,0,0
3006,toàn mua combo cháu ở nhà giá_cạnh_tranh đóng_gói vận_chuyển tốt vô_cùng,1,1,0,0,0,0,0
3007,giao hàng nhanh quà tặng đẹp chất_lượng sữa thử biết,1,0,0,0,1,0,0
3008,khuyến_mãi giá chấp_nhận mua pamper nhưnh ít quà tặng nhãn hàng,0,1,0,0,1,0,0
3009,hàng y hình thích ủng_hộ tiếp_tục cảm_ơn ️,0,0,1,0,0,0,0
3010,sản_phẩm tiện_lợi người dùng mẫu_mã bắt_mắt dễ sử_dụng,0,0,0,1,0,0,0
3011,xài tot mua giao hàng lâu luôn,1,0,0,1,0,0,0
3012,tôi đánh_giá sản phầm 5 cách phục_vụ đơn hàng giao nhanh 2h về thời_gian giao hàng chuẩn cam_kết có_điều tôi một_số điểm ổn thứ tôi đặt hang giao nhanh đăc điểm chung hàng giao nhanh bụi bẩn không_những đặt 3 lon enfa móp méo lon nắp bụi thứ hai về chương_trình khuyến_mại mua lon tặng gối bông 3 lon tặng bàn học ghi đến hết quà tôi hợp_lý biết quà hay hoàn_toàn cài hệ_thống báo khách_hàng đặt hoặc bỏ luôn thông_báo kiểu như_vậy gây hiểu lầm tôi định đặt lon cố đặt luôn 3 lon chương_trình nhận hàng thất_vọng,1,0,0,1,1,0,0
3013,giao hàng chậm tuần bỉm size nhỏ_bé 9kg đặt xl i mom cân_nhắc size bé vạch báo tả tràn bỉm mỏng đồ_chơi đẹp con thích,1,0,0,1,1,0,0
3014,mua tặng kèm hộp thuỷ_tinh nhận chán,0,0,0,0,1,0,0
3015,tã oke bạn dùng chho con loại tã vote 5,0,0,0,1,0,0,0
3016,bỉm mới date xa đóng_gói cẩn_thận size l trẻ 9kg đến 14kg bé ở nhà 10 5kg mặc_cảm giác chật bobby l mặc thoải_mái bobby mùi hương dễ_chịu vốn cục tràn ý_kiến cá_nhân tả bobby chất_lượng,1,0,0,1,0,1,0
3017,tã quần bobby gói cực_đại l54 sử_dụng tốt sạch_sẽ thoáng mát phù_hợp bé,0,0,0,1,0,1,0
3018,giao hàng nhanh bỉm mỏng loại cũ mua 445k giá_cả hợp_lý,1,1,0,1,0,0,0
3019,mua ủng_hộ tiếp_tục,0,0,0,0,0,0,1
3020,giá giảm 50 mua nhìu bé dùng dần date cũ bao_bì mới sp dùng tốt tiếp_tục ủng_hộ,0,1,0,1,0,1,0
3021,ok lam,0,0,0,0,0,0,1
3022,dùng thấm hút tốt,0,0,0,1,0,0,0
3023,tã dùng ok giá mềm size to hãng khác dùng thích,0,1,0,1,0,0,0
3024,hàng giao đúng hạn thông_báo bao_bì đóng_gói chuẩn hàng ok,1,0,0,1,0,0,0
3025,mỏng mùi khó_chịu ý trc mk mua kp mùi thôi tạm đc,0,0,0,1,0,0,0
3026,bình thường thôi giữ nhiệt bao_lâu,0,0,0,0,0,0,1
3027,bỉm thấm hút tốt giao hàng nhanh đóng_gói cẩn_thận,1,0,0,1,0,0,0
3028,giao hàng nhanh nhân_viên nhiệt_tình vui_vẻ hàng tốt tiếp_tục ủng_hộ,1,0,0,1,0,0,0
3029,đóng_gói j dk kĩ nhận dk hang dsax bong túi_bóng r sp dùng biết,0,0,0,0,0,0,0
3030,hàng chính hãng đợt mua tặng kèm 6 miếng túi giá mềm giá nguyên hài_lòng mua healthcare giao hàng nhanh tối cn đặt trưa t2 giao,1,1,1,0,0,0,0
3031,giao hàng nhanh_chóng đóng_gói cẩn_thận,1,0,0,0,0,0,0
3032,em đặt e thanh_toán tiền ạ e muốn đổi size l68 đc ạ,0,0,0,0,0,0,0
3033,hàng tốt ủng_hộ tiếp giá đầu năm mới hoei cao nhỉ,0,1,0,1,0,0,0
3034,sản_phẩm tốt giao hàng nhiệt_tình thích,1,0,0,1,0,0,0
3035,giá sale tốt,0,1,0,0,0,0,0
3036,cật nhật mẫu mới nhất quà tặng gấu bông sư_tử lỗi ở đường may,0,0,0,1,1,0,0
3037,sản_phẩm tuyệt_vời,0,0,0,0,0,0,1
3038,rẻ hiện số mua ở cửa_hàng hàng chất_lượng thưong hiệu ủng_hộ lâu_dài full 5,0,1,0,1,0,0,0
3039,giá cao mã giảm_giá tốt giá cao mã giảm_giá tốt,0,1,0,0,0,0,0
3040,rẻ giá ngoài chợ nhận hàng nhanh ủng_hộ,1,1,0,0,0,0,0
3041,bảo_quản hàng kém sản_phẩm vệ_sinh bé vỏ ngoài bẩn kinh_khủng lau biết hết bao_nhiêu giấy đen xì giấy,0,0,0,0,0,0,0
3042,sản_phẩm dùng thích da hay di ứng loại mỹ_phẩm dùng thích,0,0,0,0,0,0,0
3043,hài_lòng về sản_phẩm,0,0,0,0,0,0,1
3044,giao hàng nhanh sản_phẩm ok,1,0,0,1,0,0,0
3045,bỉm y hình giao hàng nhanh,1,0,1,0,0,0,0
3046,hoan toan hai_long voi dich vu cua va chat luong san pham,0,0,0,1,1,0,0
3047,nhận hàng check mã chính hãng nsx moi tháng 9 tháng 10 2020 sinh dùng biết bé hợp ncl ưng,0,0,1,0,0,1,0
3048,mua thứ 3 cực_kì thất_vọng về cách gói hàng hề hộp hay đơn_giản nhất xốp giảm sốc quấn nilong xung_quanh m nhận đc hộp sữa móp méo luôn ạ,1,0,0,1,0,0,0
3049,hàng chính hãng giá mềm sữa tốt con tốt thích uống ủng_hộ,0,1,1,1,0,0,0
3050,hài_lòng sản_phẩm hàng tặng kèm đúng trong hình,0,0,1,0,1,0,0
3051,nay mua bich huk ạ,0,0,0,0,0,0,0
3052,hài_lòng về chất_lượng_giáo hàng nhanh date mới,1,0,0,1,0,1,0
3053,sữa thơm dễ uống bé nhà thích uống đầu mua hộp 400 gam bé chịu hợp_tác như_vậy vui đặt mua bé uống biết đến sữa care 100 lời giới_thiệu bạn,0,0,0,1,0,0,0
3054,hàng chính hãng,0,0,1,0,0,0,0
3055,giao hàng nhanh đóng_gói đẹp chắc_chắn nha shipper thân_thiện,1,0,0,0,0,0,0
3056,tràn ngoài vón cục,0,0,0,1,0,0,0
3057,che giu ấm sua 40 sai the nao vay minh chinh nut giu am no chay den roi tắt xong sữa ngui ngắt,0,0,0,0,0,0,0
3058,hàng date mới giá tốt giao hàng nhanh nhân_viên nhiệt_tình,1,1,0,0,0,1,0
3059,bé nhà dùng hugies hăm chuyển sang dùng tốt hăm giá km rẻ mua 4b bé dùng dần,0,1,0,0,0,1,0
3060,sản_phẩm giống mô_tả thời_gian giao hàng hoi lâu,1,0,1,0,0,0,0
3061,tã xịn loại mới đóng đêm tràn thít bụng tin_dùng pamper,0,0,0,1,0,0,0
3062,y mô_tả,0,0,1,0,0,0,0
3063,sản_phẩm mới size lớn đệm lưng mềm_mại bé size tả đúng tiêu_chuẩn,0,0,0,1,0,0,0
3064,mìn check thử mã_vạch bát thông_tin về sp bịch xl vỏ bao mềm mịn bịch l hoàn_toàn khác nhìn cũ_kỹ,0,0,1,1,0,0,0
3065,la tôi hay ưu_tiên mua hàng online giao hàng nhanh đóng_gói kỹ sản_phẩm dùm bé hay to đóng_gói sữa nước ngọt con tôi thích giá mềm bên ngoài,1,1,0,1,0,0,0
3066,giao hàng nhanh giá tốt,1,1,0,0,0,0,0
3067,sản_phẩm hợp giá tiền chất_liệu ok ủng_hộ tiếp,0,1,0,1,0,0,0
3068,ít mùi đc phần chun bỉm mềm hằn da bé chắc bé cảm_thấy thoải_mái,0,0,0,1,0,0,0
3069,nhìn_chung ổn vận_chuyển nhanh mong tiếp_tục phát_huy,1,0,0,0,0,0,0
3070,qà xinh ơi_là xinh bộ bếp bé nhà thci1h lắm quà khác kg mua thay đồi quà bé á,0,0,0,0,1,0,0
3071,dùng thích sản_phẩm tốt ủng_hộ,0,0,0,1,0,0,0
3072,ghi bao_bì mới bỉm bẩn cũ sản_xuất t42019 mua hàng thế_này thất_vọng đặt mấy đơn giờ huỷ đc mới buồn,0,0,0,0,1,1,0
3073,tả mỏng thấm hút tốt,0,0,0,1,0,0,0
3074,giao hàng đúng hẹn sản_phẩm đảm_bảo bé nhà dùng ưng,1,0,0,1,0,0,0
3075,hộp gỗ xinh_xắn chắc_chắn giá 46k nghĩ rẻ,0,0,0,0,0,0,0
3076,giai hàng nhanh,1,0,0,0,0,0,0
3077,_,0,0,0,0,0,0,0
3078,tả mềm nhẹ mỏng lưng ít thun chắc bé lớn chút mới mặc,0,0,0,1,0,0,0
3079,đóg gói sơ xài hộp méo giao hàg chú_ý cẩn_thận sữa bung nắp vỡ sữa,0,0,0,0,1,0,0
3080,hàng giao nhanh nhân_viên giao hàng kẹp hàng háng gây khó_chịu,1,0,0,0,0,0,0
3081,date xa mua hàng lúc_nào hài_lòng sản_phẩm chất_lượng tiếp_tục mua huggies dài_dài,0,0,0,1,0,1,0
3082,đóng_gói đơn_giản tem đamr bảo dùng biết chất_lượng,1,0,1,0,0,0,0
3083,mới sd đầu tè bỉm chảy xệ,0,0,0,1,0,0,0
3084,tả tốt phục_vụ tốt quà giao quà đến ta đến,0,0,0,1,1,0,0
3085,sp chất_lượng,0,0,0,1,0,0,0
3086,sản_phẩm tốt đóng_gói cẩn_thận móp trong quá_trình vận_chuyển,1,0,0,1,0,0,0
3087,giao hang nhanh dong goi can than bim mong nhe tham hut tot,1,0,0,1,0,0,0
3088,lừa_đảo đặt_hàng hiển_thị quà tặng kèm đến nhận hàng quà tặng gọi điện khiếu_nại bảo chụp màn_hình làm_chứng,0,0,0,0,1,0,0
3089,tạm đc màu_sắc ok,0,0,0,0,0,0,1
3090,giao hàng nhanh đóng_gói cẩn_thận tả bobby loại lưng hút mồ_hôi thoáng bé vận_động thoải_mái,1,0,0,1,0,0,0
3091,giao hàng nhanh_chóng mặt sản_phẩm tốt,1,0,0,1,0,0,0
3092,hài_lòng,0,0,0,0,0,0,1
3093,đóng_gói đẹp giao hàng nhanh_chóng fan lâu_dài,1,0,0,0,0,0,0
3094,tả giữ form quảng_cáo mặc chút_xíu chảy xệ,0,0,0,1,0,0,0
3095,tốt va giao hang nhanh phục_vụ tốt thít la khác giờ hết đặt nè,1,0,0,1,0,0,0
3096,tả tốt giá re,0,1,0,1,0,0,0
3097,hàng giao y hình đóng_gói cẩn_thận giao hàng nhanh chu_đáo cám_ơn,1,0,1,0,1,0,0
3098,bt nho lon xai ta o con ma lan nay ta mong wa minh thay gjao hang cung la nua minh noi la mjnh co du tien doi mjnh bua ma co ng chạy vội vô nhà gjao hàng ma lam nhu nguoi ta lay zay,0,0,0,0,0,0,0
3099,sản_phẩm tốt mềm thấm hút thích boby hugies giá_thành đắt hy_vọng giá tốt hơn_nữa ok,0,1,0,1,0,0,0
3100,tả thấm hút tương_đối dày bé tè nó dày cộm,0,0,0,1,0,0,0
3101,bỉm thấm hút tốt tiếp_tục ủng_hộ,0,0,0,1,0,0,0
3102,sản_phẩm tốt giảm_giá nhờ chương_trình khuyến_mãi,0,1,0,1,1,0,0
3103,nhận hàng nhanh,1,0,0,0,0,0,0
3104,ta tham hut tot be luon kho rao mua hang co ma giam gia nen re ngang voi ta quan bobby cung loai,0,1,0,1,0,0,0
3105,giao hàng nhanh săn sale giá rẻ hàng chất_lượng hài_lòng,1,1,0,1,0,0,0
3106,giá tốt mẫu mới đẹp bên trong tả đóng bao trắng sạch_sẽ gọn_gàng dù rách bao ngoài lo_ngại bobby cải_tiến ok,1,1,0,1,0,0,0
3107,bỉm dùng thích giá_cả hợp_lý giao hàng nhanh,1,1,0,1,0,0,0
3108,sản_phẩm chất_lượng tốt đóng_gói cẩn_thận đặc_biệt giao hàng nhanh shipber nhiệt_tình ủng_hộ lâu_dài,1,0,0,1,0,0,0
3109,lưng quần cực_kì mềm_mại bé mặc vết hằn bỉm phân_biệt trước_sau thuận_tiện mẹ êm_ái bé giao hàng nhanh báo thứ 7 mới giao thứ 4 đi làm về,1,0,0,1,0,0,0
3110,mua tã bobby đầu mã giảm_giá giảm 10 giá giảm tốt mua một 3 gói luôn tã con dùng mới sinh tới giờ trải size dừng ở size xl tã thấm hút tốt thun co_giãn làm đau bé hiện ngày bé xài 4 miếng thôi bé 19 tháng,0,1,0,1,0,0,0
3111,ok ak tả sản_xuất 1772020 hàng mới tốt giao đúng hẹn giá tính rẻ mua ở tạp_hoá gần nhà dc 100k có_điều giá_cả thay_đổi liên_tục người mua lưu_ý,1,1,0,1,0,1,0
3112,ok sữa ngon,0,0,0,1,0,0,0
3113,nhận hàng nhanh mới thử thương_hiệu size lớn dùng xem chất_lượng ntn,1,0,0,0,0,0,0
3114,giao hàng cực nhanh tới 24h giao đến dù ở xa sp tã sử_dụng đánh_giá đc,1,0,0,0,0,0,0
3115,bề_mặt tả mềm_mại thấm hút ở mức trung_bình thôi cao thích nhất chuyển huggies sang bobby lưng thun hằn chặt băng_dính cuốn tả tiện bobby thường_xuyên tặng quà điểm thu_hút,0,0,0,1,1,0,0
3116,giao quà tặng đúng hết,0,0,0,0,1,0,0
3117,khuyên chân_thành đừng mua,0,0,0,0,0,0,1
3118,ta sử_dụng ok gia tốt tiết_kiệm,0,1,0,1,0,0,0
3119,hàng xài ok lắm,0,0,0,0,0,0,1
3120,sản_phẩm dùng tốt bé nhà tôi dùng toàn sản_phẩm huggies phàn_nàn bạn mua nó về dùng bé sp đóng_gói đẹp giao hàng nhanh tuyêt vời,1,0,0,1,0,0,0
3121,sản_phẩm tốt chất_lượng giao hàng nhanh đóng_gói đẹp,1,0,0,1,0,0,0
3122,giao hàng nhanh gia re,1,1,0,0,0,0,0
3123,san pham tot kich co phu hop tot tot tot tot tot tot,0,0,0,0,0,0,0
3124,chất_lượng uy_tín ok,0,0,1,1,0,0,0
3125,tã mềm thấm hút tốt giao hàng nhanh hàng chính hãng mọi ng yên_tâm,1,0,1,1,0,0,0
3126,bỉm mềm giá rẻ vs merries dùng chất_lượng thể chê đc ️,0,1,0,1,0,0,0
3127,quần bỉm dày mỏng thấm hút,0,0,0,1,0,0,0
3128,sản_phẩm dùng ok mùi nồng khả_năng thấm hút tốt,0,0,0,1,0,0,0
3129,tốt hài_lòng ủng_hộ lâu_dài nè thanks,0,0,0,0,0,0,1
3130,sx 1120 ok hay lỗi lưu kho xuất hàng check date dùng đêm vón hay ẩm mông giá cao,0,1,0,1,0,0,0
3131,mua đc giá sale 300k 4 bịch rẻ giá thị_trường,0,1,0,0,0,0,0
3132,con hay dùng loại tã thấm hút tốt mặc mùa hè nóng mới bí toàn đặt tã rẻ ở ngoài freeship,1,1,0,1,0,0,0
3133,sản_phẩm đúng mô_tả dịch_vụ now giao hàng nhanh hài_lòng,1,0,1,0,0,0,0
3134,xem_lại nhân_viên giao hàng nhận hàng để_ý về rọc rách bao rách luôn tã bên trong biết rọc làm,1,0,0,1,0,0,0
3135,hàng ok lắm nha ủng_hộ,0,0,0,0,0,0,1
3136,sản_phẩm tốt đóng_gói cẩn_thận giao hàng nhanh,1,0,0,1,0,0,0
3137,đưa hình_mẫu mới đệm mây 4 chiều người ta đặt_hàng xong giao mẫu đệm mây cũ làm_ăn uy_tín hết xưa giờ toàn mua hàng nay thất_vọng nặng_nề nhan bán hình chớ treo đầu dê bán thịt chó,0,0,0,0,0,0,0
3138,đóng_gói hàng sơ xài dính dán tùm_lum bên ngoài vỏ lon chất_lượng sữa tốt,1,0,0,1,0,0,0
3139,hàng chất_lượng tốt,0,0,0,1,0,0,0
