,text,aspect1,aspect2,aspect3,aspect4,aspect5,aspect6,aspect7
0,mua đóng_gói cẩn_thận hình_ảnh mang tc kiếm xu,1,0,0,0,0,0,0
1,đóng_gói cẩn_thận giao hàng nhanh bé uống hợp ủng_hộ,1,0,0,1,0,0,0
2,giao hàng nhanh chắc_chắn sản_phẩm tốt ủng_hộ dài_dài,1,0,0,1,0,0,0
3,giao hàng nhanh đóng cẩn_thận móp một hộp dùng đánh_giá chất_lượng,1,0,0,0,1,0,0
4,hình_ảnh liên_quan giao hàng nhanh đóng_gói cẩn_thận mua,1,0,0,0,0,0,0
5,mua nhieu làn lam roi ủng ho tiep ánnjdjr sbhsjd bạndn bahhđm bajsnmd nạnkdkd bâjjdjmd majdjfmf,0,0,0,0,0,0,0
6,sữa bột date đóng_gói kỹ móp méo balo chắc_chắn xịn sò đáng mua,1,0,0,0,1,1,0
7,bán flash sale giá tốt hộp giao nguyên_vẹn date 2022 ưng_ý luôn,1,1,0,0,0,1,0
8,khoe bác món tai heo cuộn chuẩn_bị tai heo sả hành khô hạt_tiêu gia_vị gừng rượu gừng muối,0,0,0,0,0,0,0
9,laz tính phí ship giao hàng ngày shoppe tính phí giao hàng giao hàng lâu hên hết sữa mua dự_trữ sẵn trc đợi giao chắc con đói,1,0,0,0,0,0,0
10,sp tốt nha,0,0,0,1,0,0,0
11,con hợp_tác vs sữa,0,0,0,0,0,0,1
12,hàng ok chất_lượng mua ạkkkkkkkkkkkkkkkkkkkkkkkkkkkk,0,0,0,1,0,0,0
13,nhận hàng đóng hói cẩn_thận,1,0,0,0,0,0,0
14,giao hàng nhanh dã_man đóng_gói cẩn_thận nè mn mua ak,1,0,0,0,0,0,0
15,nhận hàng giao hàng nhanh giá_cả cạnh_tranh mua lâng tới,1,1,0,0,0,0,0
16,tôi mua trữ sẵn con nhân khuyến_mãi dịch giao hàng lâu lẻ bên vận_chuyển delay,1,1,0,0,0,0,0
17,sữa thơm ngon biết bé tăng cân ạ hiệu_quả nhất_định ủng_hộ dài_dài,0,0,0,1,0,0,0
18,mua biết đánh_giá hiiiiii,0,0,0,0,0,0,1
19,jaksb dvdkd hsjsh djsks iwgeo jdjxj jdjdj jsnbd oakqpq ndjdj sjkdk,0,0,0,0,0,0,0
20,hàng chất_lượng mua nh r,0,0,0,1,0,0,0
21,sữa bé uống ok ạ uống tin_dùng hãng thui mua dc giá rẻ ạ mua lon đặt lon,0,1,0,1,0,0,0
22,hài_lòng đóng_gói hàng cẩn_thận đúng date ủng_hộ,1,0,0,0,0,1,0
23,mua hàng thất_vọng méo mất hộp giao hàng tận 12 hôm mới nhận đc hàng thoi hay mua hàng 5 tiếp_tục ủng_hộ ️ ️,1,0,0,0,0,0,0
24,mua phát hàng nhanh phục_vụ tốt ủng_hộ lâu_dài,1,0,0,0,1,0,0
25,giao hàng nhanh đóng_gói sp cẩn_thận chất_lượng sản_phẩm tốt,1,0,0,1,0,0,0
26,hộp móp,1,0,0,0,0,0,0
27,sữa chuẩn đóng_gói cẩn_thận mua 3 4 tiếp_tục ủng_hộ,1,0,1,0,0,0,0
28,giao hàng nhanh sản_phẩm hài_lòng ủng_hộ,1,0,0,1,0,0,0
29,giao hàng nhanh đóng_gói chắc_chắn chất_lượng sản_phẩm tốt bé thích uống hài_lòng,1,0,0,1,0,0,0
30,hàng oki lâng nhi cầu ủng_hộ đợt m đặt gửi m bill úc tốt thanks,0,0,0,1,0,0,0
31,giao hàng bình_thường lon sữa mốp chất_lượng tốt mua tiếp,1,0,0,1,0,0,0
32,đóng_gói cẩn_thận sản_phẩm trong hình tuyệt_vời ad ơi,1,0,1,0,0,0,0
33,giao hàng nhanh hy_vọng con uống hạp sữa mua tiếp,1,0,0,0,0,0,0
34,giao hàng nhanh đóng_gói cẩn_thận giá rẻ ngoài tt ủng_hộ lsau,1,1,0,0,0,0,0
35,giao hàng nhanh mua quà tặng kèm,1,0,0,0,1,0,0
36,giao hàng nhanh thắc_mắc loại sữa mới lúc_lắc sữa tan nổi bọt trắng lâu tan hộp trước_đây con bú kg biết kg,1,0,0,0,0,0,0
37,yubest chân ái bé nhà đóng xuyên đêm thay nhnnn,0,0,0,1,0,0,0
38,giao hàng nhanh đóng_gói cẩn_thận chắc_chắn hài_lòng chất_lượng biết sử_dụng,1,0,0,0,0,0,0
39,giao hàng nhanh hy_vọng bé uống hợp ủng_hộ dài,1,0,0,0,0,0,0
40,gói hàng cẩn_thận sợ méo hộp hành date xa hy_vọng con h,1,0,0,0,0,1,0
41,nói lấy xu thôi khen ngại ahihih đủ chữ,0,0,0,0,0,0,1
42,giao hàng nhanh đc tặng sữa gói,1,0,0,0,1,0,0
43,mua,0,0,0,0,0,0,1
44,ship hàng siêu nhanh đặt trưa sáng nay nhận đc cskh tốt cháu dùng thích ủng_hộ tiếp,1,0,0,0,1,0,0
45,nhận hàng mong bạn nhỏ nhà thích mua,0,0,0,0,0,0,1
46,nhận hàng giao hàng nhanh đóng_gói cẩn_thận,1,0,0,0,0,0,0
47,sản_phẩm tốt hạn sử_dụng xa yên_tâm,0,0,0,1,0,1,0
48,đóng_gói lon móp méo hết v,1,0,0,0,0,0,0
49,sữa thơm chuẩn đặt hôm hôm nhận luôn tốt,1,0,0,1,0,0,0
50,chất_lượng sản_phẩm tốt giao hàng nhanh đóng_gói sản_phẩm cẩn_thận,1,0,0,1,0,0,0
51,bọc chống xốc đầy_đủ móp hxjxjjcjcjcjcjcjjc hàng ok xhxjxjjcjcjc,1,0,0,0,0,0,0
52,giao hàng nhanh đóng_gói sản_phẩm cẩn_thận hình_ảnh liên_quan chúc bán đk hàng,1,0,0,0,0,0,0
53,mua 4 hộp sữa che mã_vạch giao hàng nhanh tận_tình ủng_hộ dài_dài nha lười chụp hình,1,0,1,0,1,0,0
54,mua thứ n chả bbiết nói bbiết nhanh nhiệt_tình,1,0,0,0,1,0,0
55,gói hàng chắc_chắn sản_phẩm thật tốt giao hàng thật nhanh,1,0,0,1,0,0,0
56,sữa dê ưithmom tem chống hàng giả cty phương linh đóng_gói hàng cẩn_thận móp méo đc tặng yếm ăn dặm dễ_thương,0,0,1,0,1,0,0
57,giao hàng siêu nhanh mua t3,1,0,0,0,0,0,0
58,mua n okeeeee hiii chất_lượng khỏi bànn hihiii đánh_giá nhận xu hoyyyy cám_ơn aạaaaa ảnh lấy tạm ạ,0,0,0,1,0,0,0
59,nhận hàng giao hàng nhanh đóng_gói cẩn_thận chất_lượng sản_phẩm giá tiền dùng biết chất_lượng ok con thích ủng_hộ,1,0,0,0,0,0,0
60,chất_lượng sản_phẩm y hình giao hàng nhanh,1,0,1,0,0,0,0
61,gửi hàng nhanh đóng_gói chắc_chắn vận_chuyển về móp một xíu uống biết chất_lượng sữa tn,1,0,0,0,0,0,0
62,nhớ mua thứ bao_nhiêu,0,0,0,0,0,0,1
63,sữa thơm ngon hoa_quả date xa gói hàng cẩn_thận tiếp_tục ủng_hộ,1,0,0,1,0,1,0
64,nhìn bên ngoài ok dùng biết giao cực lâu xém định huỷ đơn,1,0,0,1,0,0,0
65,đóng_gói chắc_chắn giao hàng nhanh,1,0,0,0,0,0,0
66,chat luong oki giao hang nhanh da mua nhieu lan ung hộ dai,1,0,0,1,0,0,0
67,dhhgjj guuegh jhdjjjh vhgdtt hhdrtu hitedf jgđtu cret gfuy ggggh,0,0,0,0,0,0,0
68,giao hàng nhanh check dc mã_vạch mở nắp biết chất_lượng thế_nào đóng_gói chăc chắn,1,0,1,0,0,0,0
69,đóng_gói hàng kỹ giao hàng nhanh giá tốt hạn_dùng xa mua nhu_cầu,1,1,0,0,0,1,0
70,date mới đóng hàng cẩn_thận hi_vọng bé thích,1,0,0,0,0,1,0
71,hàng đóng_gói okie sản_phẩm sử_dụng biết như_thế_nào mua đứa em sử_dụng phản_hồi nghe nói sữa abbot tốt mua thử xem,1,0,0,0,0,0,0
72,sản_phẩm chất_lượng giá_cả phải_chăng mua ở thất_vọng,0,1,0,1,0,0,0
73,giao hàng lâu rep tin nhắn khách sữa date xa nâng cao chất_lượng phục_vụ khách_hàng hơn_nữa động_viên 5sao,1,0,0,0,1,1,0
74,đóng_gói cẩn_thận sữa chuẩn date xa mua tiếp_tục ủng_hộ,1,0,1,0,0,1,0
75,mua thứ gói hàng siêu cẩn_thận ủng_hộ tới,1,0,0,0,0,0,0
76,sữa kid essential hàng đi air nội_địa úc 800gr dành trẻ tuổi biếng ăn còi_xương sữa béo kid essentials mẹ hỏi sữa về tăng cân con e giới_thiệu dòng sữa béo nhận phản_hồi tốt ạ,0,0,0,0,0,0,0
77,nắp bạc nhăn_nheo,0,0,0,0,1,0,0
78,giao hàng nhanh gói hàng kỹ mua chu_đáo,1,0,0,0,0,0,0
79,ship nhanh giá rẻ hàng chuẩn trả_lời khách nhanh thứ n mua,1,1,1,0,1,0,0
80,chất_lượng tốt chất_lượng tốt chất_lượng tốt chất_lượng tốt chất_lượng tốt chất_lượng tốt,0,0,0,1,0,0,0
81,sữa date dài đóng_gói chắc_chắn giao hàng nhanh_chóng ủng_hộ dài,1,0,0,1,0,1,0
82,sản_phẩm uống hết r kịp nêu cảm_nhận,0,0,0,0,0,0,1
83,giao đủ hàng chút nhầm_lẫn thành đề ủng_hộ tiếp_tục,1,0,0,0,0,0,0
84,hàng giao nhanh chất_lượng tốt 3,1,0,0,1,0,0,0
85,hàng mẫu đóng_gói cẩn_thận dùng thử mẫu_mã bên ngoài giống mẫu,1,0,1,0,0,0,0
86,gói hàng cẩn_thận giao hàng nhanh con tv uống sữa đỡ táo hẳn,1,0,0,0,0,1,0
87,luôn ủng_hộ chất_lượng giá_cả hợp_lý,0,1,0,1,0,0,0
88,đóng_gói cẩn_thận hộp sữa móp,1,0,0,0,0,0,0
89,chat luong san pham tot dong goi hang can than giao hang nhanh,1,0,0,1,0,0,0
90,chất_lượng ok giống bỉm ở khác mua tuy_nhiên đóng kèm quà tặng,0,0,0,1,1,0,0
91,nhận đc sữa tốt ủng_hộ tiếpjjhjjgjgjgjgfjfjfjfjdjdjdjd,0,0,0,1,0,0,0
92,gói hàng cẩn_thận date xa,1,0,0,0,0,1,0
93,mua hàng bên mua trong th gấp ch chủ luôn hỗ_trợ kịp_thời cảm_ơn ch chúc ch kinh_doanh hồng phát,0,0,0,0,1,0,0
94,chất_lượng oki kkkkkkkkkkkkkkkkkkkkkkkkkkkkkkkkkkkkkkkkkk,0,0,0,1,0,0,0
95,thời_gian giao hàng nhanh chất_lượng sản_phẩm tốt đóng_gói cẩn_thận,1,0,0,1,0,0,0
96,giá rẻ e bé hợp_tác buồn giao hàng nhanh ủng_hộ,1,1,0,0,0,0,0
97,đóng_gói cẩn_thận giao hàng nhanh giá rẻ check mã biết thật giả bé hợp_tác ủng_hộ dài,1,1,0,0,0,0,0
98,jsjdsijso dksjs dksns ksks sọ diwj điehneoe sshdi eidj eisj,0,0,0,0,0,0,0
99,sp đóng_gói cẩn_thận date 2022 vote 5,1,0,0,0,0,1,0
100,sản_phẩm chất_lượng tốt đóng_gói cẩn_thận giao hàng nhanh_chóng,1,0,0,1,0,0,0
101,ảnh lấy tạm ảnh khác đóng_gói đẹp giao nhanh date dài thank,1,0,0,1,0,1,0
102,hàng tốt date xa,0,0,0,1,0,1,0
103,đóng_gói sp chắc_chắn sữa thơm ngon tiếc bé nhà e chịu hợp_tác,1,0,0,1,0,0,0
104,sữa móp đánh_giá 5 dc,1,0,0,0,0,0,0
105,nhận hàng mở sử_dụng đánh_giá đc,0,0,0,0,0,0,1
106,hàng tốt chất_lượng ok 5sao nha nhà iu kem mặn nhận 200 xu ố la,0,0,0,1,0,0,0
107,sp giống mua date xa ok lắm,0,0,0,1,0,1,0
108,mua ủng họp lâu_dài,0,0,0,0,0,0,1
109,sản_phẩm tốt sữa thơm pha giao hàng nhanh,1,0,0,1,0,0,0
110,biết s dùng keo gắn bột milo đc mịn đc ngon lắm bé thích,0,0,0,1,0,1,0
111,hàng ok dong gói ok nói_chung rẻ giá ở thị_trường check ma vạch,0,1,1,1,0,0,0
112,biết đến yubest m trung_thành nó dòng bỉm mỏng nhẹ thấm hút tốt giá_cả phải_chăng mua ah,0,1,0,1,0,0,0
113,đầu mua tem chống hàng giả yên_tâm date dài ủng_hộ,0,0,1,0,0,1,0
114,giao hàng nhanh shiper thân_thiện đóng_gói cẩn_thận đủ số_lượng,1,0,0,0,1,0,0
115,giao hàng nhanh mua sữa ở mong hàng chuẩn thôi,1,0,0,0,0,0,0
116,mua sale rẻ ở ngoài mấy chục lận mặc_dù con lon sữa sp tem đầy_đủ,0,1,1,0,0,0,0
117,sản_phẩm tốt đóng_gói cẩn_thận giao hàng oke mọi người mua,1,0,0,1,0,0,0
118,nhận đc hàng ship cbi đồ siêu nhanh 6h tối_qua đặt sáng 9h nhận đc r bọc gói kỹ date mới biết móp vs giá sale thái_độ phục_vụ xứng_đáng 5 thanks,1,1,0,0,1,1,0
119,hộp nguyên_vẹn giao hàng chậm tí bé uống sữa ngoài ngày,1,0,0,0,0,0,0
120,đóng_gói cẩn_thận sữa hsd xa cảm_ơn shopppppppppppppp,1,0,0,0,0,1,0
121,sản_phẩm ok mong hàng chuẩn,0,0,0,1,0,0,0
122,mua hàng ok giao sữa date cũ lô nói_chung ok,0,0,0,1,0,1,0
123,date xa đóng_gói sp chắc_chắn giao hàng nhanh hình_ảnh mang tc nhận xu,1,0,0,0,0,1,0
124,đóng_gói chắc_chắn giao hàng chậm cảm_ơn shopppppppppp,1,0,0,0,1,0,0
125,dùng đánh_giá đk có_vẻ ok chugyfgghuuuuuhhhh,0,0,0,0,0,0,1
126,đóng_gói chắc_chắn kĩ_càng dán chặt,1,0,0,0,0,0,0
127,giao hàng nhanh đóng_gói hàng cẩn_thận date tháng 3 2021,1,0,0,0,0,1,0
128,ok nha date cũ mua bên mall hàng chuẩn chính hãng dc hoàn xu,0,0,1,1,0,0,0
129,khác bao_bì mấy lon mua ở quét mã thông_tin đúng vị thơm ngon,0,0,1,1,0,0,0
130,chất_lượng sản_phẩm tốt giao hàng nhanh gói hàng chắc_chắn,1,0,0,1,0,0,0
131,nhận hàng đóng_gói chắc_chắn giao hàng nhanh slsjwhaj,1,0,0,0,0,0,0
132,sp tốt mua giá flash sale đóng_gói sản_phẩm đẹp chắc_chắn date xa,1,1,0,1,0,1,0
133,thời_gian giao hàng nhanh đóng_gói sản_phẩm chắc_chắn sản_phẩm tốt mua,1,0,0,0,0,0,0
134,giao hàng siêu nhanh đóng_gói chắc_chắn date xa_lắc luôn hi_vọng con hợp sữa tăng cân ủng_hộ,1,0,0,1,0,1,0
135,hàng tốt giao hàng nhanh đóng_gói sản_phẩm chắc_chắn đáng tiền,1,1,0,1,0,0,0
136,video mang tính_chất nhận xu ạ hihi vỏ gối dùng thích lắm ạ dày_dặn mọi ngươgi mua,0,0,0,0,1,0,0
137,giao hàng nhanh đóng_gói tương_đối hạn_dùng xa 2021 hài_lòng,1,0,0,1,0,1,0
138,hàng y hình đóng_gói hàng cẩn_thận thời_gian giao hàng nhanh mua giá sale ưng_ý chất lg tốt mua ok,1,1,1,0,0,0,0
139,giao hàng nhanh đóng_gói sản_phẩm cẩn_thận chất_lượng sử_dụng biết thế_nào,1,0,0,0,0,0,0
140,sản_phẩm giống y hình đóng_gói móp méo phù_hợp túi_tiền ủng_hộ,1,1,1,0,0,0,0
141,mua 3 rùi ưng tiếp_tục ủng_hộ,0,0,0,0,0,0,1
142,nhận hàng giáo hàng nhanh đóng_gói cẩn_thận giá ưu_đãi chất_lượng dùng giám nhận_xét ủng_hộ chất_lượng tốt,1,1,0,0,0,0,0
143,đóng_gói chắc_chắn giao siêu nhanh hàng công_ty đỡ lo trúng hàng giả,1,0,1,0,0,0,0
144,hàng chuẩn chính hãng đóng_gói cẩn_thận ủng_hộ,1,0,1,0,0,0,0
145,giao hàng nhanh bỉm dùng thích ủng_hộ sp tiếp dùng,1,0,0,1,0,0,0
146,uống lên_cân,0,0,0,0,0,0,1
147,chât lương tốt đong goi đẹp ủng_hộ,1,0,0,1,0,0,0
148,sản_phẩm săn sale tuyệt_vời sử_dụng nhưngx bạn nhu_cầu mua thích chọn thời_điểm thích_hợp mua sale mã giảm,0,0,0,0,0,0,1
149,giao hàng nhanh đóng_gói cẩn_thận ủng_hộ uy_tín chất_lượng tốt,1,0,0,1,1,0,0
150,mua lần_lần móp xíu chắc bên vận_chuyển đóng_gói kỷ nè thanks nha,1,0,0,0,0,0,0
151,ủng_hộ ủng_hộ ủng_hộ ủng_hộ ủng_hộ,0,0,0,0,0,0,0
152,giao hàng nhanh chất_lượng sản_phẩm tốt ủng_hộ tiếp,1,0,0,1,0,0,0
153,đóng_gói đẹp giao hàng nhanh quà tặng balo đẹp lắm nha mua kèm deals 0 đồng,1,1,0,0,1,0,0
154,bỉm ok mọi_khi có_điều mùi nồng,0,0,0,1,0,1,0
155,hàng chuẩn giao hàng nhanh bé nhà mk thích uống mk ủng_hộ tiếp thank,1,0,1,0,0,0,0
156,giao đúng hàng đóng_gói ổn,1,0,0,0,0,0,0
157,chịu ảnh_hưởng,0,0,0,0,0,0,0
158,giao hàng nhanh lắm luôn mặc_dù ở hà_nội ở tp hcm date xa đúng mô_tả giá tốt,1,1,0,0,0,1,0
159,xin chào chuyên hàng auth tuồn quảng châu xuất xịn mời mọi người ghé xem đồ nhaaaaa ️ ️,0,0,0,0,0,0,0
160,vỏ sữa khác khác xuất_xứ khác nhau mong nhàng tốt ủng_hộ tiếp giao hàng cực nhanh gói hàng cẩn_thận,1,0,0,0,0,0,0
161,bỉm tốt giá rẻ hình_ảnh mag tính_chất câu xu 12345,0,1,0,1,0,0,0
162,giao hàng nhanh đóng_gói cẩn_thận sản_phẩm chất_lượng date mới mẫu_mã mới đẹp,1,0,0,1,0,1,0
163,minh mua roi chất_lượng tốt date xa giao hàng nhanh nnnnnnnmnnnnnnnn,1,0,0,1,0,1,0
164,ok mua ở ủng_hộ dài_dài dvvc đợt lâu xíu,1,0,0,0,0,0,0
165,mua sữa ở thật_sự tệ trong tphcm 4 ngày mới nhận đc đóng hàng cẩn_thận vỏ hộp giấy bên trong mố méo đủ kiểu,1,0,0,0,0,0,0
166,giao hangg nhậnhbdnsnsnnsnsnsnkskdnsjsjsnnsndnndndjdkd,0,0,0,0,0,0,0
167,mua ủng_hộ tiếp,0,0,0,0,0,0,1
168,giao hàng nhanh date dài,1,0,0,0,0,1,0
169,hàng giao nhanh đóng_gói kỹ giá hợp_lý phục tốt,1,1,0,0,1,0,0
170,đóng_gói kỹ giao hang nhanh chăm_sóc khách_hàng tốt mua nhìu,1,0,0,0,1,0,0
171,giao hàng nhanh sữa thay_đổi mẫu date xa mua,1,0,0,0,0,1,0
172,chất_lượng sản_phẩm tuyệt_vời đóng_gói sản_phẩm chắc_chắn thời_gian giao hàng nhanh cảm_ơn tiếp_tục ủng_hộ ạ,1,0,0,1,0,0,0
173,gói hàng cẩn_thận lắm nha giao nhanh luôn sữa date 2022 giá mềm thanks,1,1,0,1,0,1,0
174,đầu mua sữa online giá rẻ mua trong siêu_thị mở hộp sữa độ thơm sữa bằng hộp sưa mik mua ở sthi,0,1,0,1,0,0,0
175,mua 3 ở oki,0,0,0,1,0,0,1
176,giao hàng lâu,1,0,0,0,0,0,0
177,mua hàng giao nhanh gói kỹ giá_cạnh_tranh thông_báo giảm_giá liên_tục uy_tín,1,1,1,0,0,0,0
178,chất_lượng sản_phẩm tuyệt_vời chất_lượng sản_phẩm tuyệt_vời,0,0,0,1,0,0,0
179,giao hàng nhanh đóng_gói cẩn_thận thanks hhhhhhhh,1,0,0,0,0,0,0
180,đóng_gói thận giao hàng nhanh nay miễn ship giá cao mọi_khi,1,1,0,0,0,0,0
181,sản_phẩm đúng mọi tả đóng_gói chắc_chắn giá_cả hợp_lý tiếp_tục ủng_hộ ️,1,1,1,0,0,0,0
182,giao hàng cực nhanh nhaaaaaaaaaaaa sữa check code đc hhahahahahahahaha,1,0,1,0,0,0,0
183,chất_lượng tuyệt_vời mua ở hộp méo mua cải_thiện giao hàng nhanh,1,0,0,1,0,0,0
184,date tháng 052021 chất_lượng sản_phẩm tuyệt_vời đóng_gói chắc_chắn,1,0,0,1,0,0,0
185,đóng_gói chắc_chắn giao hàng sẻ mất tgian lâu bạn muốn đặt đặt sớm vài ngày trc hết sữa,1,0,0,0,0,0,0
186,hàng đẹp lắm ưng mua jsjdjjdksldkdnkdkdj,0,0,0,1,0,0,0
187,ngon bổ rẻ mua sản_phẩm,0,1,0,1,0,0,0
188,ba hộp móp ảnh_hưởng tới sữa bên trong hôm_qua mới mở hộp đầu_ra bé uống mùi sữa thơm ngậy,1,0,0,1,0,0,0
189,to bao gạo nhận hàng giật bác ạ dùng thử angel night nay thử gold con đóng ngày đóng thử thấm hút thua xa night đóng xong con nổi vài mụn ở gần khu_vực hậu_môn ẩm mông mặc_dù đóng tiếng 20p,0,0,0,1,0,1,0
190,đóng_gói cẩn_thận thời_gian giao hàng nhanh sử_dụng ok ủng_hộ dài_dài,1,0,0,1,0,0,0
191,sữa đóng bọc chắc_chắn móp méo hết hàng giao nhanh ủng_hộ,1,0,0,0,0,0,0
192,chất_lượng sản_phẩm tốt giao hàng đóng_gói cẩn_thận chúc ngày_càng phát_triển hơn_nữa,1,0,0,1,0,0,0
193,mua mấy đóng_gói ưng bé uống hợp ủng_hộ sh,1,0,0,0,0,0,0
194,sữa thơm ngon béo ngậy trộm_vía bé hợp lắm mẹ_con biếng ăn thử nha,0,0,0,1,0,0,0
195,lon sữa móp đóng gơi kỹ,1,0,0,0,0,0,0
196,giá_thành rẻ date xa đóng_gói cẩn_thận giao hàng nhak,1,1,0,0,0,1,0
197,hàng tốt đóng bọc cẩn thânh chất_lượng khỏi bàn mua sữa thơm ngon lắm ạ đặt hôm hôm nhận luôn tks,1,0,0,1,0,0,0
198,mua bé hết bón ít bệnh vặt hấp_thu tốt,0,0,0,0,0,1,0
199,date xa bột siêu mịn thơm pha ngậy dã mann ngọt lắm đúng tiêu_chí dùng đồ ít đường có_điều pha xong cốc rửa xà_phòng toàn mùi sữa ngậy khủng_khiếp luôn,0,0,0,1,0,1,0
200,diễn_tả,0,0,0,0,0,0,1
201,sữa thơm sánh bé nhà thích vị đóng_gói cẩn_thận giao hàng nhanh lắm,1,0,0,1,0,0,0
202,sp tốt chất_lượng giá rẻ cực nhiệt_tình tặng quà đáng yêu mua tiếp,0,1,0,1,1,0,0
203,sản_phẩm ok đóng_gói kĩ giao hàng nhanh thaks,1,0,0,1,0,0,0
204,dùng sữa ok mọi người ơi,0,0,0,1,0,0,0
205,hàng đúng rẻ bên ngoài check ok thử xem bé chịu ủng_hộ tiếp,0,1,1,0,0,0,0
206,đóng_gói siêu chắc_chắn vận_chuyển nhanh date dài,1,0,0,0,0,1,0
207,okokokokoko kokkkkko kokkk okokokokokkkkokkskxkckssicjzlxkjckcox,0,0,0,1,0,0,0
208,tin_tưởng mua sản_phẩm shopp,0,0,0,0,0,0,1
209,thời_gian giao hàng nhanh đóng_gói sản_phẩm chắc_chắn giá_thành tạm,1,1,0,0,0,0,0
210,hàng nhận mô_tả tem nhập chính hãng,0,0,1,0,0,0,0
211,giao nhanh hàng nhìn chuẩn sử_dụng,1,0,1,0,0,0,0
212,hộp sữa mang về giống y_chang hộp mua ở kidsplaza tem đến nhãn phụ luôn ý,0,0,1,0,0,0,0
213,sản_phẩm tốt,0,0,0,1,0,0,0
214,chất_lượng sản_phẩm tốt đóng_gói đẹp kĩ phục_vụ nhiệt_tình thời_gian giao hàng nhanh đợt lỗi nhỏ giao hàng thiếu mong xảy,1,0,0,1,1,0,0
215,đặt_hàng chiều_qua sáng nay nhận đc ủng_hộ tiếp chất_lượng đảm_bảo nha,1,0,0,0,0,0,0
216,giao hàng nhanh đóng_gói cẩn_thận ok,1,0,0,0,0,0,0
217,sản_phẩm tốt thời_gian giao hàng nhanh đóng_gói cẩn_thận,1,0,0,1,0,0,0
218,sữa chính hãng mua đặc_biệt hay flash sale,0,1,1,0,0,0,0
219,hướng_dẫn cách chơi đồ leona mùa 11 guide sp hỗ_trợ bảng ngọc bổ_trợ leona trang_bị đánh mạnh nhất top build full tank siêu trâu cao_thủ pro thứ_tự tăng bộ kỹ_năng cộng phép bổ_trợ,0,0,0,0,0,0,0
220,ok thank s mnxjdjdjejdjdjffdkoaosjdjdjdkdkdkowoqoaoaqkoqoooooopqksjsjsjsksoswoosksjsjdjdệdjdjdjfocodjjdjdosoajsnd,0,0,0,1,0,0,0
221,giao hàng nhanh chiều hôm_qua đặt sáng hôm nhận đc hàng,1,0,0,0,0,0,0
222,túi zíp khoá lỗi ấn ktra kĩ trc giao kh giao hàng nhanh,1,0,0,0,1,0,0
223,nhận hàng clip mang tính_chất nhận xu,0,0,0,0,0,0,1
224,giao hàng nhanh giao hàng nhanh giao hàng nhanh giao hàng nhanh giao hàng nhanh giao hàng nhanh giao hàng nhanh giao hàng nhanh giao hàng nhanh,1,0,0,0,0,0,0
225,nhận hàng cảm_ơn nhanh đầy_đủ,1,0,0,0,0,0,0
226,hình_ảnh mang tính_chất nhận xu,0,0,0,0,0,0,0
227,nhận hàng siêu nhanh đính kèm quà xinh yêu thanks,1,0,0,0,1,0,0
228,free ship extral tuyệt_vời luôn hàng ngon giao vận_chuyển lâu,1,0,0,1,0,0,0
229,sữa date xa sữa thơm đúng ý,0,0,0,1,0,1,0
230,giao hàng nhanh,1,0,0,0,0,0,0
231,giao hàng siêu nhanh sản_phẩm bọc kĩ_càng móp méo,1,0,0,0,0,0,0
232,check mã_vạch ok uống biến ngon,0,0,1,0,0,0,0
233,giao hàng nhanh ủng_hộ đóng_gói sản_phẩm kỹ cẩn_thận,1,0,0,0,0,0,0
234,ship nhanh hàng chuẩn giá tốt ship nhanh hàng chuẩn giá tốt,1,1,1,0,0,0,0
235,giá rẻ ngoài cửa_hàng chất_lượng dùng biết phản_hồi ncl ok nhưng_mà hình bảo tặng kèm quà nhận hàng quà đâu nhỉ,0,1,0,0,1,0,0
236,mua ở khác bé thích uống pha 140ml hết sạch nay mua về uống mấy bữa bé uống đc tầm nửa biết hàng giả,0,0,0,1,0,0,0
237,sản_phẩm ok check mã trả_lời tin nhắn khách nhanh thân_thiện hỗ_trợ tốt khách cảm_ơn mua tiếp,0,0,1,0,1,0,0
238,nan nga nắp màu xanh nhỉ mọi mua nắp nâu,0,0,1,0,0,0,0
239,sp tốt mua,0,0,0,1,0,0,0
240,giao hàng siêu nhanh đóng_gói cực cẩn_thận mua ưng về sản_phẩm,1,0,0,1,0,0,0
241,giao đủ hàng nhanh sản_phẩm ok tiếp_tục ủng_hộ,1,0,0,1,0,0,0
242,cảm_ơn giai hang nhanh méo hàng chuẩn ủng_hộ tiếp,1,0,1,0,0,0,0
243,đóng hàng chuyên_nghiệp giao hàng nhanh cảm_ơn,1,0,0,0,0,0,0
244,đóng_gói sp chắc_chắn giao hàng nhanh giá tốt,1,1,0,0,0,0,0
245,nhận đc hàng bé thử biết hợp_tác bé htac ủng_hộ,0,0,0,0,0,0,1
246,ok bncnmxmđnnd ggghhhjkkkkb bnmmbbnnn bnnmmmmmmnbbbnnjnnnn,0,0,0,1,0,0,0
247,giao hàng nhanh hàng chuẩn chất_lượng tốt giá rẻ mua ạ,1,1,1,1,0,0,0
248,giao hàng nhanh phục_vụ tốt mua bên lần_lần hài_lòng,1,0,0,0,1,0,0
249,giao hàng siêu nhanh dùng xong đánh_giá tiếp đóng_gói cẩn_thận,1,0,0,0,0,0,0
250,mua hàng đầu_hàng chuan ủng_hộ dài hi_vọng luôn lấy uy_tín chất_lượng hàng_đầu sữa con,1,0,1,0,0,0,0
251,đặt giao hàng nhanh đóng_gói cẩn thân ️ ️ ️ ️ ️ ️,1,0,0,0,0,0,0
252,mặc toàn trào chắc hàng chuẩn rôi,0,0,1,1,0,0,0
253,ủng_hộ 5 chúc ngày_càng phát_triển sữa pediasure hương vani 850g date mới nhất 2021 phân_loại hàng 850g,0,0,0,0,0,0,0
254,nhận đúng hàng giao đúng thời_điểm đóng_gói kĩ bóp_méo,1,0,0,0,0,0,0
255,chất_lượng sản_phẩm tốt đóng_gói cẩn_thận giao hàng nhanh,1,0,0,1,0,0,0
256,sản_phẩm chất_lượng làm_việc hiệu_quả thời_gian giao hàng nhanh mua,1,0,0,1,1,0,0
257,bé thích ăn loại thơm ngon giá hợp_lý,0,1,0,1,0,0,0
258,hộp đóng chắc_chắn móp méo date dài dùng thử ok ủng_hộ,1,0,0,0,0,1,0
259,mua nói_chung đánh_giá năm tư_vấn nhiệt_tình lắm,0,0,0,0,1,0,0
260,đầu mua ở mua 3 hộp móp hộp nhiệt_tình 5,1,0,0,0,1,0,0
261,bỉm mỏng mềm giá hợp_lý mua bdndnnxnxnnxnxnxnxncmncnxnxn,0,1,0,1,0,0,0
262,giao hàng siêu nhanh chất_lượng đảm_bảo đóng_gói sp hài_lòng,1,0,0,1,0,0,0
263,sữa thơm lắm y hàng mua ở mẹ bé nói_chung hàng nhập_khẩu ok mẹ ạ,0,0,0,1,0,0,0
264,giao hàng nhanh đóng_gói hàng chắc_chắn hộp sữa móp dán băng keo date hình_như mua giao date xa,1,0,0,0,1,0,0
265,sữa chuẩn cảm_ơn sdffggffghjnjnvvbbnkkjjjgc,0,0,1,0,0,0,0
266,đóng_gói sp đẹp lon móp méo tí thời_gian giao hàng nhanh,1,0,0,0,0,0,0
267,hộp sữa méo tí đít hộp giao hàng nhanh giá rẻ cửa_hàng mẹ bé,1,1,0,0,0,0,0
268,tv 3 hôm bé quen chuyển luôn sáng sữa ủng_hộ,0,0,0,0,0,0,1
269,mua sữa giá rẻ trông giống sữa chính hãng vọng hàng chất_lượng,0,1,1,0,0,0,0
270,giao hàng nhanh đóng_gói cẩn_thận móp méo mua hàng hài_lòng ủng_hộ lâu_dài,1,0,0,0,0,0,0
271,giao hàng nhanh đóng_gói cẩn_thận hi_vọng sữa chính hãng ủng_hộ,1,0,0,0,0,0,0
272,nhận đc hàng sử_dụng sử_dụng đánh_giá saub,0,0,0,0,0,0,1
273,giao hàng nhanh sữa check mã_vạch giao nowship sữa trong túi đơn hay bọc gói,1,0,1,0,0,0,0
274,ok dhedxbgnrwvbkjfwwvbjjywdbxagdvhuureehi7632ccnbxz vfwsvt32cvcvb feqvfwrh,0,0,0,1,0,0,0
275,giao hàng nhanh_chóng sản_phẩm đóng_gói đẹp cẩn_thận cám_ơn,1,0,0,0,0,0,0
276,sản_phẩm tốt giá rẻ giao hàng nhanh mọi người mua,1,1,0,1,0,0,0
277,hàng nhận rùi pediasure mua lắm rùi giao hàng nhanh nhưg a shipper khó_chịu ghê_hà,1,0,0,0,1,0,0
